name	ID	manual	auto	checked	blacklisted	is_obsolete
leukocyte tethering or rolling	GO_0050901	1	1	1	0	0
leukocyte proliferation	GO_0070661	1	1	1	0	0
leukocyte migration involved in inflammatory response	GO_0002523	1	1	1	0	0
leukocyte migration	GO_0050900	1	1	1	0	0
leukocyte mediated immunity	GO_0002443	1	1	1	0	0
leukocyte mediated cytotoxicity	GO_0001909	1	1	1	0	0
leukocyte homeostasis	GO_0001776	1	1	1	0	0
leukocyte differentiation	GO_0002521	1	1	1	0	0
leukocyte degranulation	GO_0043299	1	1	1	0	0
leukocyte chemotaxis involved in inflammatory response	GO_0002232	1	1	1	0	0
leukocyte chemotaxis	GO_0030595	1	1	1	0	0
leukocyte cell-cell adhesion	GO_0007159	1	1	1	0	0
leukocyte apoptotic process	GO_0071887	1	1	1	0	0
leukocyte aggregation	GO_0070486	1	1	1	0	0
leukocyte adhesive activation	GO_0050902	1	1	1	0	0
leukocyte activation-dependent arrest	GO_0050903	1	1	1	0	0
leukocyte activation involved in inflammatory response	GO_0002269	1	1	1	0	0
leukocyte activation	GO_0045321	1	1	1	0	0
type IV hypersensitivity	GO_0001806	0	1	1	0	0
type IIb hypersensitivity	GO_0001795	0	1	1	0	0
type IIa hypersensitivity	GO_0001794	0	1	1	0	0
type III hypersensitivity	GO_0001802	0	1	1	0	0
type II hypersensitivity	GO_0002445	0	1	1	0	0
type I hypersensitivity mediated by mast cells	GO_0002558	0	1	1	0	0
type I hypersensitivity mediated by basophils	GO_0002559	0	1	1	0	0
type I hypersensitivity	GO_0016068	0	1	1	0	0
transitional two stage B cell differentiation	GO_0002334	0	1	1	0	0
transitional stage B cell differentiation	GO_0002332	0	1	1	0	0
transitional one stage B cell differentiation	GO_0002333	0	1	1	0	0
thymocyte migration	GO_0072679	0	1	1	0	0
thymocyte apoptotic process	GO_0070242	0	1	1	0	0
thymocyte aggregation	GO_0071594	0	1	1	0	0
thymic T cell selection	GO_0045061	0	1	1	0	0
termination of T cell signal transduction	GO_0023022	0	1	1	0	0
telencephalon microglial cell migration	GO_0022033	0	1	1	0	0
susceptibility to natural killer cell mediated cytotoxicity	GO_0042271	0	1	1	0	0
susceptibility to T cell mediated cytotoxicity	GO_0060370	0	1	1	0	0
suppression by virus of host natural killer cell activation	GO_0039672	0	1	1	0	0
specific granule membrane	GO_0035579	0	1	0	0	0
specific granule lumen	GO_0035580	0	1	0	0	0
specific granule	GO_0042581	0	1	0	0	0
serotonin secretion by mast cell	GO_0002552	0	1	1	0	0
serotonin secretion by basophil	GO_0002556	0	1	1	0	0
regulatory T cell differentiation	GO_0045066	0	1	1	0	0
regulatory T cell apoptotic process	GO_1902482	0	1	1	0	0
regulation of type IV hypersensitivity	GO_0001807	0	1	1	0	0
regulation of type IIb hypersensitivity	GO_0001799	0	1	1	0	0
regulation of type IIa hypersensitivity	GO_0001796	0	1	1	0	0
regulation of type III hypersensitivity	GO_0001803	0	1	1	0	0
regulation of type II hypersensitivity	GO_0002892	0	1	1	0	0
regulation of type I hypersensitivity	GO_0001810	0	1	1	0	0
regulation of thymocyte migration	GO_2000410	0	1	1	0	0
regulation of thymocyte apoptotic process	GO_0070243	0	1	1	0	0
regulation of thymocyte aggregation	GO_2000398	0	1	1	0	0
regulation of regulatory T cell differentiation	GO_0045589	0	1	1	0	0
regulation of pro-T cell differentiation	GO_2000174	0	1	1	0	0
regulation of positive thymic T cell selection	GO_1902232	0	1	1	0	0
regulation of plasmacytoid dendritic cell cytokine production	GO_0002736	0	1	1	0	0
regulation of plasmacytoid dendritic cell antigen processing and presentation	GO_0002610	0	1	1	0	0
regulation of plasma cell differentiation	GO_1900098	0	1	1	0	0
regulation of peripheral T cell tolerance induction	GO_0002849	0	1	1	0	0
regulation of peripheral B cell deletion	GO_0002908	0	1	1	0	0
regulation of peripheral B cell anergy	GO_0002917	0	1	1	0	0
regulation of osteoclast proliferation	GO_0090289	0	1	1	0	0
regulation of osteoclast differentiation	GO_0045670	0	1	1	0	0
regulation of osteoclast development	GO_2001204	0	1	1	0	0
regulation of neutrophil migration	GO_1902622	0	1	1	0	0
regulation of neutrophil mediated killing of symbiont cell	GO_0070949	0	1	1	0	0
regulation of neutrophil mediated killing of gram-positive bacterium	GO_0070952	0	1	1	0	0
regulation of neutrophil mediated killing of gram-negative bacterium	GO_0070951	0	1	1	0	0
regulation of neutrophil mediated killing of fungus	GO_0070953	0	1	1	0	0
regulation of neutrophil mediated killing of bacterium	GO_0070950	0	1	1	0	0
regulation of neutrophil mediated cytotoxicity	GO_0070948	0	1	1	0	0
regulation of neutrophil extravasation	GO_2000389	0	1	1	0	0
regulation of neutrophil differentiation	GO_0045658	0	1	1	0	0
regulation of neutrophil degranulation	GO_0043313	0	1	1	0	0
regulation of neutrophil chemotaxis	GO_0090022	0	1	1	0	0
regulation of neutrophil apoptotic process	GO_0033029	0	1	1	0	0
regulation of neutrophil aggregation	GO_2000428	0	1	1	0	0
regulation of neutrophil activation	GO_1902563	0	1	1	0	0
regulation of natural killer cell tolerance induction	GO_0002871	0	1	1	0	0
regulation of natural killer cell proliferation involved in immune response	GO_0032820	0	1	1	0	0
regulation of natural killer cell proliferation	GO_0032817	0	1	1	0	0
regulation of natural killer cell mediated immunity	GO_0002715	0	1	1	0	0
regulation of natural killer cell mediated immune response to tumor cell	GO_0002855	0	1	1	0	0
regulation of natural killer cell mediated cytotoxicity directed against tumor cell target	GO_0002858	0	1	1	0	0
regulation of natural killer cell mediated cytotoxicity	GO_0042269	0	1	1	0	0
regulation of natural killer cell differentiation involved in immune response	GO_0032826	0	1	1	0	0
regulation of natural killer cell differentiation	GO_0032823	0	1	1	0	0
regulation of natural killer cell degranulation	GO_0043321	0	1	1	0	0
regulation of natural killer cell cytokine production	GO_0002727	0	1	1	0	0
regulation of natural killer cell chemotaxis	GO_2000501	0	1	1	0	0
regulation of natural killer cell apoptotic process	GO_0070247	0	1	1	0	0
regulation of natural killer cell activation	GO_0032814	0	1	1	0	0
regulation of myeloid leukocyte mediated immunity	GO_0002886	0	1	1	0	0
regulation of myeloid leukocyte differentiation	GO_0002761	0	1	1	0	0
regulation of myeloid dendritic cell cytokine production	GO_0002733	0	1	1	0	0
regulation of myeloid dendritic cell chemotaxis	GO_2000527	0	1	1	0	0
regulation of myeloid dendritic cell antigen processing and presentation	GO_0002607	0	1	1	0	0
regulation of myeloid dendritic cell activation	GO_0030885	0	1	1	0	0
regulation of mononuclear cell proliferation	GO_0032944	0	1	1	0	0
regulation of mononuclear cell migration	GO_0071675	0	1	1	0	0
regulation of monocyte extravasation	GO_2000437	0	1	1	0	0
regulation of monocyte differentiation	GO_0045655	0	1	1	0	0
regulation of monocyte chemotaxis	GO_0090025	0	1	1	0	0
regulation of monocyte antigen processing and presentation	GO_0002613	0	1	1	0	0
regulation of monocyte aggregation	GO_1900623	0	1	1	0	0
regulation of microglia differentiation	GO_0014006	0	1	1	0	0
regulation of memory T cell differentiation	GO_0043380	0	1	1	0	0
regulation of memory T cell activation	GO_2000567	0	1	1	0	0
regulation of mature B cell apoptotic process	GO_0002905	0	1	1	0	0
regulation of mast cell proliferation	GO_0070666	0	1	1	0	0
regulation of mast cell differentiation	GO_0060375	0	1	1	0	0
regulation of mast cell degranulation	GO_0043304	0	1	1	0	0
regulation of mast cell cytokine production	GO_0032763	0	1	1	0	0
regulation of mast cell chemotaxis	GO_0060753	0	1	1	0	0
regulation of mast cell apoptotic process	GO_0033025	0	1	1	0	0
regulation of mast cell activation involved in immune response	GO_0033006	0	1	1	0	0
regulation of mast cell activation	GO_0033003	0	1	1	0	0
regulation of macrophage tolerance induction	GO_0010932	0	1	1	0	0
regulation of macrophage fusion	GO_0034239	0	1	1	0	0
regulation of macrophage differentiation	GO_0045649	0	1	1	0	0
regulation of macrophage cytokine production	GO_0010935	0	1	1	0	0
regulation of macrophage chemotaxis	GO_0010758	0	1	1	0	0
regulation of macrophage apoptotic process	GO_2000109	0	1	1	0	0
regulation of macrophage antigen processing and presentation	GO_0002616	0	1	1	0	0
regulation of macrophage activation	GO_0043030	0	1	1	0	0
regulation of lymphocyte proliferation	GO_0050670	0	1	1	0	0
regulation of lymphocyte migration	GO_2000401	0	1	1	0	0
regulation of lymphocyte mediated immunity	GO_0002706	0	1	1	0	0
regulation of lymphocyte differentiation	GO_0045619	0	1	1	0	0
regulation of lymphocyte chemotaxis	GO_1901623	0	1	1	0	0
regulation of lymphocyte apoptotic process	GO_0070228	0	1	1	0	0
regulation of lymphocyte anergy	GO_0002911	0	1	1	0	0
regulation of lymphocyte activation	GO_0051249	0	1	1	0	0
regulation of leukocyte tethering or rolling	GO_1903236	0	1	1	0	0
regulation of leukocyte proliferation	GO_0070663	0	1	1	0	0
regulation of leukocyte migration	GO_0002685	0	1	1	0	0
regulation of leukocyte mediated immunity	GO_0002703	0	1	1	0	0
regulation of leukocyte mediated cytotoxicity	GO_0001910	0	1	1	0	0
regulation of leukocyte differentiation	GO_1902105	0	1	1	0	0
regulation of leukocyte degranulation	GO_0043300	0	1	1	0	0
regulation of leukocyte chemotaxis	GO_0002688	0	1	1	0	0
regulation of leukocyte cell-cell adhesion	GO_1903037	0	1	1	0	0
regulation of leukocyte apoptotic process	GO_2000106	0	1	1	0	0
regulation of leukocyte activation	GO_0002694	0	1	1	0	0
regulation of isotype switching to IgG isotypes	GO_0048302	0	1	1	0	0
regulation of isotype switching to IgE isotypes	GO_0048293	0	1	1	0	0
regulation of isotype switching to IgD isotypes	GO_0048299	0	1	1	0	0
regulation of isotype switching to IgA isotypes	GO_0048296	0	1	1	0	0
regulation of isotype switching	GO_0045191	0	1	1	0	0
regulation of interleukin-4-dependent isotype switching to IgE isotypes	GO_2000571	0	1	1	0	0
regulation of immunological synapse formation	GO_2000520	0	1	1	0	0
regulation of immunoglobulin production in mucosal tissue	GO_2000557	0	1	1	0	0
regulation of immunoglobulin mediated immune response	GO_0002889	0	1	1	0	0
regulation of immature T cell proliferation in thymus	GO_0033084	0	1	1	0	0
regulation of immature T cell proliferation	GO_0033083	0	1	1	0	0
regulation of humoral immune response mediated by circulating immunoglobulin	GO_0002923	0	1	1	0	0
regulation of histamine secretion by mast cell	GO_1903593	0	1	1	0	0
regulation of granulocyte differentiation	GO_0030852	0	1	1	0	0
regulation of granulocyte chemotaxis	GO_0071622	0	1	1	0	0
regulation of gamma-delta T cell proliferation	GO_0046646	0	1	1	0	0
regulation of gamma-delta T cell differentiation	GO_0045586	0	1	1	0	0
regulation of gamma-delta T cell activation involved in immune response	GO_2001191	0	1	1	0	0
regulation of gamma-delta T cell activation	GO_0046643	0	1	1	0	0
regulation of fibronectin-dependent thymocyte migration	GO_2000413	0	1	1	0	0
regulation of extrathymic T cell differentiation	GO_0033082	0	1	1	0	0
regulation of eosinophil migration	GO_2000416	0	1	1	0	0
regulation of eosinophil extravasation	GO_2000419	0	1	1	0	0
regulation of eosinophil differentiation	GO_0045643	0	1	1	0	0
regulation of eosinophil degranulation	GO_0043309	0	1	1	0	0
regulation of eosinophil chemotaxis	GO_2000422	0	1	1	0	0
regulation of eosinophil activation	GO_1902566	0	1	1	0	0
regulation of dendritic cell differentiation	GO_2001198	0	1	1	0	0
regulation of dendritic cell cytokine production	GO_0002730	0	1	1	0	0
regulation of dendritic cell chemotaxis	GO_2000508	0	1	1	0	0
regulation of dendritic cell apoptotic process	GO_2000668	0	1	1	0	0
regulation of dendritic cell antigen processing and presentation	GO_0002604	0	1	1	0	0
regulation of cytotoxic T cell differentiation	GO_0045583	0	1	1	0	0
regulation of cytotoxic T cell degranulation	GO_0043317	0	1	1	0	0
regulation of complement activation, classical pathway	GO_0030450	0	1	1	0	0
regulation of central B cell tolerance induction	GO_0002895	0	1	1	0	0
regulation of central B cell deletion	GO_0002898	0	1	1	0	0
regulation of central B cell anergy	GO_0002914	0	1	1	0	0
regulation of cellular extravasation	GO_0002691	0	1	1	0	0
regulation of basophil differentiation	GO_0045640	0	1	1	0	0
regulation of basophil degranulation	GO_1903581	0	1	1	0	0
regulation of antibody-dependent cellular cytotoxicity	GO_0001813	0	1	1	0	0
regulation of alpha-beta T cell proliferation	GO_0046640	0	1	1	0	0
regulation of alpha-beta T cell differentiation	GO_0046637	0	1	1	0	0
regulation of alpha-beta T cell activation	GO_0046634	0	1	1	0	0
regulation of activation-induced cell death of T cells	GO_0070235	0	1	1	0	0
regulation of activated T cell proliferation	GO_0046006	0	1	1	0	0
regulation of activated T cell autonomous cell death	GO_0070239	0	1	1	0	0
regulation of T-helper cell differentiation	GO_0045622	0	1	1	0	0
regulation of T-helper 2 cell differentiation	GO_0045628	0	1	1	0	0
regulation of T-helper 2 cell cytokine production	GO_2000551	0	1	1	0	0
regulation of T-helper 2 cell activation	GO_2000569	0	1	1	0	0
regulation of T-helper 17 type immune response	GO_2000316	0	1	1	0	0
regulation of T-helper 17 cell lineage commitment	GO_2000328	0	1	1	0	0
regulation of T-helper 17 cell extravasation	GO_2000455	0	1	1	0	0
regulation of T-helper 17 cell differentiation	GO_2000319	0	1	1	0	0
regulation of T-helper 1 type immune response	GO_0002825	0	1	1	0	0
regulation of T-helper 1 cell differentiation	GO_0045625	0	1	1	0	0
regulation of T-helper 1 cell cytokine production	GO_2000554	0	1	1	0	0
regulation of T-helper 1 cell activation	GO_2000517	0	1	1	0	0
regulation of T cell tolerance induction to tumor cell	GO_0002846	0	1	1	0	0
regulation of T cell tolerance induction	GO_0002664	0	1	1	0	0
regulation of T cell receptor signaling pathway	GO_0050856	0	1	1	0	0
regulation of T cell proliferation	GO_0042129	0	1	1	0	0
regulation of T cell migration	GO_2000404	0	1	1	0	0
regulation of T cell mediated immunity	GO_0002709	0	1	1	0	0
regulation of T cell mediated immune response to tumor cell	GO_0002840	0	1	1	0	0
regulation of T cell mediated cytotoxicity directed against tumor cell target	GO_0002852	0	1	1	0	0
regulation of T cell mediated cytotoxicity	GO_0001914	0	1	1	0	0
regulation of T cell homeostatic proliferation	GO_0046013	0	1	1	0	0
regulation of T cell extravasation	GO_2000407	0	1	1	0	0
regulation of T cell differentiation in thymus	GO_0033081	0	1	1	0	0
regulation of T cell differentiation	GO_0045580	0	1	1	0	0
regulation of T cell cytokine production	GO_0002724	0	1	1	0	0
regulation of T cell costimulation	GO_2000523	0	1	1	0	0
regulation of T cell chemotaxis	GO_0010819	0	1	1	0	0
regulation of T cell apoptotic process	GO_0070232	0	1	1	0	0
regulation of T cell antigen processing and presentation	GO_0002625	0	1	1	0	0
regulation of T cell anergy	GO_0002667	0	1	1	0	0
regulation of T cell activation via T cell receptor contact with antigen bound to MHC molecule on antigen presenting cell	GO_2001188	0	1	1	0	0
regulation of T cell activation	GO_0050863	0	1	1	0	0
regulation of NK T cell proliferation	GO_0051140	0	1	1	0	0
regulation of NK T cell differentiation	GO_0051136	0	1	1	0	0
regulation of NK T cell activation	GO_0051133	0	1	1	0	0
regulation of CD8-positive, alpha-beta cytotoxic T cell extravasation	GO_2000452	0	1	1	0	0
regulation of CD8-positive, alpha-beta T cell proliferation	GO_2000564	0	1	1	0	0
regulation of CD8-positive, alpha-beta T cell extravasation	GO_2000449	0	1	1	0	0
regulation of CD8-positive, alpha-beta T cell differentiation	GO_0043376	0	1	1	0	0
regulation of CD8-positive, alpha-beta T cell activation	GO_2001185	0	1	1	0	0
regulation of CD4-positive, alpha-beta T cell proliferation	GO_2000561	0	1	1	0	0
regulation of CD4-positive, alpha-beta T cell differentiation	GO_0043370	0	1	1	0	0
regulation of CD4-positive, alpha-beta T cell costimulation	GO_1900279	0	1	1	0	0
regulation of CD4-positive, alpha-beta T cell activation	GO_2000514	0	1	1	0	0
regulation of CD4-positive, CD25-positive, alpha-beta regulatory T cell differentiation involved in immune response	GO_0032832	0	1	1	0	0
regulation of CD4-positive, CD25-positive, alpha-beta regulatory T cell differentiation	GO_0032829	0	1	1	0	0
regulation of B-1 B cell differentiation	GO_0001924	0	1	1	0	0
regulation of B cell tolerance induction	GO_0002661	0	1	1	0	0
regulation of B cell receptor signaling pathway	GO_0050855	0	1	1	0	0
regulation of B cell proliferation	GO_0030888	0	1	1	0	0
regulation of B cell mediated immunity	GO_0002712	0	1	1	0	0
regulation of B cell differentiation	GO_0045577	0	1	1	0	0
regulation of B cell deletion	GO_0002867	0	1	1	0	0
regulation of B cell cytokine production	GO_0002721	0	1	1	0	0
regulation of B cell chemotaxis	GO_2000537	0	1	1	0	0
regulation of B cell apoptotic process	GO_0002902	0	1	1	0	0
regulation of B cell antigen processing and presentation	GO_0002622	0	1	1	0	0
regulation of B cell anergy	GO_0002670	0	1	1	0	0
regulation of B cell activation	GO_0050864	0	1	1	0	0
protein localization to mast cell secretory granule	GO_0033367	0	1	1	0	0
protein localization to T cell secretory granule	GO_0033374	0	1	1	0	0
protection from natural killer cell mediated cytotoxicity	GO_0042270	0	1	1	0	0
protease localization to mast cell secretory granule	GO_0033368	0	1	1	0	0
protease localization to T cell secretory granule	GO_0033375	0	1	1	0	0
pre-B cell differentiation	GO_0002329	0	1	1	0	0
positive thymic T cell selection	GO_0045059	0	1	1	0	0
positive regulation of type IV hypersensitivity	GO_0001809	0	1	1	0	0
positive regulation of type IIb hypersensitivity	GO_0001801	0	1	1	0	0
positive regulation of type IIa hypersensitivity	GO_0001798	0	1	1	0	0
positive regulation of type III hypersensitivity	GO_0001805	0	1	1	0	0
positive regulation of type II hypersensitivity	GO_0002894	0	1	1	0	0
positive regulation of type I hypersensitivity	GO_0001812	0	1	1	0	0
positive regulation of thymocyte migration	GO_2000412	0	1	1	0	0
positive regulation of thymocyte apoptotic process	GO_0070245	0	1	1	0	0
positive regulation of thymocyte aggregation	GO_2000400	0	1	1	0	0
positive regulation of regulatory T cell differentiation	GO_0045591	0	1	1	0	0
positive regulation of pro-T cell differentiation	GO_2000176	0	1	1	0	0
positive regulation of positive thymic T cell selection	GO_1902234	0	1	1	0	0
positive regulation of plasmacytoid dendritic cell cytokine production	GO_0002738	0	1	1	0	0
positive regulation of plasmacytoid dendritic cell antigen processing and presentation	GO_0002612	0	1	1	0	0
positive regulation of plasma cell differentiation	GO_1900100	0	1	1	0	0
positive regulation of peripheral T cell tolerance induction	GO_0002851	0	1	1	0	0
positive regulation of peripheral B cell deletion	GO_0002910	0	1	1	0	0
positive regulation of peripheral B cell anergy	GO_0002919	0	1	1	0	0
positive regulation of osteoclast proliferation	GO_0090290	0	1	1	0	0
positive regulation of osteoclast differentiation	GO_0045672	0	1	1	0	0
positive regulation of osteoclast development	GO_2001206	0	1	1	0	0
positive regulation of neutrophil migration	GO_1902624	0	1	1	0	0
positive regulation of neutrophil mediated killing of symbiont cell	GO_0070961	0	1	1	0	0
positive regulation of neutrophil mediated killing of gram-positive bacterium	GO_0070964	0	1	1	0	0
positive regulation of neutrophil mediated killing of gram-negative bacterium	GO_0070963	0	1	1	0	0
positive regulation of neutrophil mediated killing of fungus	GO_0070965	0	1	1	0	0
positive regulation of neutrophil mediated killing of bacterium	GO_0070962	0	1	1	0	0
positive regulation of neutrophil mediated cytotoxicity	GO_0070960	0	1	1	0	0
positive regulation of neutrophil extravasation	GO_2000391	0	1	1	0	0
positive regulation of neutrophil differentiation	GO_0045660	0	1	1	0	0
positive regulation of neutrophil degranulation	GO_0043315	0	1	1	0	0
positive regulation of neutrophil chemotaxis	GO_0090023	0	1	1	0	0
positive regulation of neutrophil apoptotic process	GO_0033031	0	1	1	0	0
positive regulation of neutrophil aggregation	GO_2000430	0	1	1	0	0
positive regulation of neutrophil activation	GO_1902565	0	1	1	0	0
positive regulation of natural killer cell tolerance induction	GO_0002873	0	1	1	0	0
positive regulation of natural killer cell proliferation involved in immune response	GO_0032822	0	1	1	0	0
positive regulation of natural killer cell proliferation	GO_0032819	0	1	1	0	0
positive regulation of natural killer cell mediated immunity	GO_0002717	0	1	1	0	0
positive regulation of natural killer cell mediated immune response to tumor cell	GO_0002857	0	1	1	0	0
positive regulation of natural killer cell mediated cytotoxicity directed against tumor cell target	GO_0002860	0	1	1	0	0
positive regulation of natural killer cell mediated cytotoxicity	GO_0045954	0	1	1	0	0
positive regulation of natural killer cell differentiation involved in immune response	GO_0032828	0	1	1	0	0
positive regulation of natural killer cell differentiation	GO_0032825	0	1	1	0	0
positive regulation of natural killer cell degranulation	GO_0043323	0	1	1	0	0
positive regulation of natural killer cell cytokine production	GO_0002729	0	1	1	0	0
positive regulation of natural killer cell chemotaxis	GO_2000503	0	1	1	0	0
positive regulation of natural killer cell apoptotic process	GO_0070249	0	1	1	0	0
positive regulation of natural killer cell activation	GO_0032816	0	1	1	0	0
positive regulation of myeloid leukocyte mediated immunity	GO_0002888	0	1	1	0	0
positive regulation of myeloid leukocyte differentiation	GO_0002763	0	1	1	0	0
positive regulation of myeloid dendritic cell cytokine production	GO_0002735	0	1	1	0	0
positive regulation of myeloid dendritic cell chemotaxis	GO_2000529	0	1	1	0	0
positive regulation of myeloid dendritic cell antigen processing and presentation	GO_0002609	0	1	1	0	0
positive regulation of myeloid dendritic cell activation	GO_0030887	0	1	1	0	0
positive regulation of mononuclear cell proliferation	GO_0032946	0	1	1	0	0
positive regulation of mononuclear cell migration	GO_0071677	0	1	1	0	0
positive regulation of monocyte extravasation	GO_2000439	0	1	1	0	0
positive regulation of monocyte differentiation	GO_0045657	0	1	1	0	0
positive regulation of monocyte chemotaxis	GO_0090026	0	1	1	0	0
positive regulation of monocyte antigen processing and presentation	GO_0002615	0	1	1	0	0
positive regulation of monocyte aggregation	GO_1900625	0	1	1	0	0
positive regulation of microglia differentiation	GO_0014008	0	1	1	0	0
positive regulation of memory T cell differentiation	GO_0043382	0	1	1	0	0
positive regulation of memory T cell activation	GO_2000568	0	1	1	0	0
positive regulation of mature B cell apoptotic process	GO_0002907	0	1	1	0	0
positive regulation of mast cell proliferation	GO_0070668	0	1	1	0	0
positive regulation of mast cell differentiation	GO_0060376	0	1	1	0	0
positive regulation of mast cell degranulation in other organism	GO_0035896	0	1	1	0	0
positive regulation of mast cell degranulation	GO_0043306	0	1	1	0	0
positive regulation of mast cell cytokine production	GO_0032765	0	1	1	0	0
positive regulation of mast cell chemotaxis	GO_0060754	0	1	1	0	0
positive regulation of mast cell apoptotic process	GO_0033027	0	1	1	0	0
positive regulation of mast cell activation involved in immune response	GO_0033008	0	1	1	0	0
positive regulation of mast cell activation by Fc-epsilon receptor signaling pathway	GO_0038097	0	1	1	0	0
positive regulation of mast cell activation	GO_0033005	0	1	1	0	0
positive regulation of macrophage tolerance induction	GO_0010933	0	1	1	0	0
positive regulation of macrophage fusion	GO_0034241	0	1	1	0	0
positive regulation of macrophage differentiation	GO_0045651	0	1	1	0	0
positive regulation of macrophage cytokine production	GO_0060907	0	1	1	0	0
positive regulation of macrophage chemotaxis	GO_0010759	0	1	1	0	0
positive regulation of macrophage apoptotic process	GO_2000111	0	1	1	0	0
positive regulation of macrophage antigen processing and presentation	GO_0002618	0	1	1	0	0
positive regulation of macrophage activation	GO_0043032	0	1	1	0	0
positive regulation of lymphocyte proliferation	GO_0050671	0	1	1	0	0
positive regulation of lymphocyte migration	GO_2000403	0	1	1	0	0
positive regulation of lymphocyte mediated immunity	GO_0002708	0	1	1	0	0
positive regulation of lymphocyte differentiation	GO_0045621	0	1	1	0	0
positive regulation of lymphocyte apoptotic process	GO_0070230	0	1	1	0	0
positive regulation of lymphocyte anergy	GO_0002913	0	1	1	0	0
positive regulation of lymphocyte activation	GO_0051251	0	1	1	0	0
positive regulation of leukocyte tethering or rolling	GO_1903238	0	1	1	0	0
positive regulation of leukocyte proliferation	GO_0070665	0	1	1	0	0
positive regulation of leukocyte migration	GO_0002687	0	1	1	0	0
positive regulation of leukocyte mediated immunity	GO_0002705	0	1	1	0	0
positive regulation of leukocyte mediated cytotoxicity	GO_0001912	0	1	1	0	0
positive regulation of leukocyte differentiation	GO_1902107	0	1	1	0	0
positive regulation of leukocyte degranulation	GO_0043302	0	1	1	0	0
positive regulation of leukocyte chemotaxis	GO_0002690	0	1	1	0	0
positive regulation of leukocyte cell-cell adhesion	GO_1903039	0	1	1	0	0
positive regulation of leukocyte apoptotic process	GO_2000108	0	1	1	0	0
positive regulation of leukocyte activation	GO_0002696	0	1	1	0	0
positive regulation of isotype switching to IgG isotypes	GO_0048304	0	1	1	0	0
positive regulation of isotype switching to IgE isotypes	GO_0048295	0	1	1	0	0
positive regulation of isotype switching to IgD isotypes	GO_0048301	0	1	1	0	0
positive regulation of isotype switching to IgA isotypes	GO_0048298	0	1	1	0	0
positive regulation of isotype switching	GO_0045830	0	1	1	0	0
positive regulation of interleukin-4-dependent isotype switching to IgE isotypes	GO_2000572	0	1	1	0	0
positive regulation of immunological synapse formation	GO_2000522	0	1	1	0	0
positive regulation of immunoglobulin production in mucosal tissue	GO_2000558	0	1	1	0	0
positive regulation of immunoglobulin mediated immune response	GO_0002891	0	1	1	0	0
positive regulation of immature T cell proliferation in thymus	GO_0033092	0	1	1	0	0
positive regulation of immature T cell proliferation	GO_0033091	0	1	1	0	0
positive regulation of humoral immune response mediated by circulating immunoglobulin	GO_0002925	0	1	1	0	0
positive regulation of histamine secretion by mast cell	GO_1903595	0	1	1	0	0
positive regulation of granulocyte differentiation	GO_0030854	0	1	1	0	0
