Roche CV	GO term name	GO term ID	
sex female	female courtship behavior	GO:0008050
sex female	female gamete generation	GO:0007292
sex female	female genitalia development	GO:0030540
sex female	female genitalia morphogenesis	GO:0048807
sex female	female germ-line cyst encapsulation	GO:0048139
sex female	female germ-line cyst formation	GO:0048135
sex female	female germ-line sex determination	GO:0019099
sex female	female germ-line stem cell division	GO:0048132
sex female	female germ-line stem cell maintenance	GO:0036099
sex female	female germline ring canal formation	GO:0007301
sex female	female germline ring canal formation, actin assembly	GO:0008302
sex female	female germline ring canal stabilization	GO:0008335
sex female	female gonad development	GO:0008585
sex female	female mating behavior	GO:0060180
sex female	female meiosis	GO:0007143
sex female	female meiosis I	GO:0007144
sex female	female meiosis II	GO:0007147
sex female	female meiosis chromosome segregation	GO:0016321
sex female	female meiosis chromosome separation	GO:0051309
sex female	female meiosis sister chromatid cohesion	GO:0007066
sex female	female meiotic chromosome movement towards spindle pole	GO:0016345
sex female	female pigmentation	GO:0048095
sex female	female pregnancy	GO:0007565
sex female	female pronucleus assembly	GO:0035038
sex female	female sex determination	GO:0030237
sex female	female sex differentiation	GO:0046660
sex female	female somatic sex determination	GO:0019101
sex female	female urethra development	GO:0061070
sex female	germarium-derived female germ-line cyst encapsulation	GO:0030708
sex female	germarium-derived female germ-line cyst formation	GO:0030727
sex female	imaginal disc-derived female genitalia development	GO:0007486
sex female	imaginal disc-derived female genitalia morphogenesis	GO:0048804
sex female	male-female gamete recognition during double fertilization	GO:0080173
sex female	maternal process involved in female pregnancy	GO:0060135
sex female	negative regulation of female gonad development	GO:2000195
sex female	negative regulation of female pigmentation	GO:0048090
sex female	negative regulation of female receptivity	GO:0007621
sex female	negative regulation of female receptivity, post-mating	GO:0045434
sex female	positive regulation of female gonad development	GO:2000196
sex female	positive regulation of female pigmentation	GO:0048091
sex female	positive regulation of female receptivity	GO:0045925
sex female	positive regulation of female receptivity, post-mating	GO:0046009
sex female	regulation of female gonad development	GO:2000194
sex female	regulation of female pigmentation	GO:0048089
sex female	regulation of female receptivity	GO:0045924
sex female	regulation of female receptivity, post-mating	GO:0046008
sex determination	W chromosome	GO:0000804
sex determination	X chromosome	GO:0000805
sex determination	Y chromosome	GO:0000806
sex determination	Z chromosome	GO:0000807
sex determination	primary sex determination	GO:0007538
sex determination	primary sex determination, germ-line	GO:0007542
sex determination	primary sex determination, soma	GO:0007539
sex determination	processes downstream of sex determination signal	GO:0007545
sex determination	sex chromosome	GO:0000803
sex determination	sex determination	GO:0007530
sex determination	sex determination, establishment of X:A ratio	GO:0007540
sex determination	sex determination, primary response to X:A ratio	GO:0007541
sex determination	sex determination, somatic-gonadal interaction	GO:0007543
sex determination	sex differentiation	GO:0007548
sex	asexual reproduction	GO:0019954
sex	asexual spore wall assembly	GO:0042243
sex	asexual sporulation	GO:0030436
sex	asexual sporulation resulting in formation of a cellular spore	GO:0043936
sex	asexual sporulation resulting in formation of a multicellular or syncytial spore	GO:0075284
sex	development of primary sexual characteristics	GO:0045137
sex	development of secondary sexual characteristics	GO:0045136
sex	genital disc sexually dimorphic development	GO:0035263
sex	germ-line processes downstream of sex determination signal	GO:0007547
sex	germ-line sex determination	GO:0018992
sex	hermaphrodite germ-line sex determination	GO:0040021
sex	hermaphrodite somatic sex determination	GO:0042001
sex	mating behavior, sex discrimination	GO:0048047
sex	negative regulation of asexual sporulation resulting in formation of a cellular spore	GO:0043944
sex	negative regulation of sexual sporulation resulting in formation of a cellular spore	GO:0043942
sex	positive regulation of asexual sporulation resulting in formation of a cellular spore	GO:0043945
sex	positive regulation of sexual sporulation resulting in formation of a cellular spore	GO:0043941
sex	regulation of asexual sporulation	GO:0034305
sex	regulation of asexual sporulation resulting in formation of a cellular spore	GO:0043943
sex	regulation of sexual sporulation	GO:0034306
sex	regulation of sexual sporulation resulting in formation of a cellular spore	GO:0043940
sex	sex comb development	GO:0045498
sex	sex-specific pigmentation	GO:0048071
sex	sexual reproduction	GO:0019953
sex	sexual spore wall assembly	GO:0034294
sex	sexual sporulation	GO:0034293
sex	sexual sporulation resulting in formation of a cellular spore	GO:0043935
sex	sexual sporulation resulting in formation of a multicellular or syncytial spore	GO:0075285
sex	somatic processes downstream of sex determination signal	GO:0007546
sex	somatic sex determination	GO:0018993
sex	sporocarp development involved in asexual reproduction	GO:0000905
sex	sporocarp development involved in sexual reproduction	GO:0000909
Ser/Thr kinase signaling	negative regulation of transmembrane receptor protein serine/threonine kinase signaling pathway	GO:0090101
Ser/Thr kinase signaling	positive regulation of transmembrane receptor protein serine/threonine kinase signaling pathway	GO:0090100
Ser/Thr kinase signaling	regulation of transmembrane receptor protein serine/threonine kinase signaling pathway	GO:0090092
Ser/Thr kinase signaling	transmembrane receptor protein serine/threonine kinase signaling pathway	GO:0007178
Ser/Thr kinase signaling	transmembrane receptor protein serine/threonine kinase signaling pathway involved in floral organ abscission	GO:0060869
secretion	autocrine signaling	GO:0035425
salt stress response	cellular hyperosmotic response	GO:0071474
salt stress response	cellular hyperosmotic salinity response	GO:0071475
salt stress response	cellular hypotonic response	GO:0071476
salt stress response	cellular hypotonic salinity response	GO:0071477
NAME	GO_TERM_ID	ROCHE_GO_SLIM	Map to existing GO term		Notes	
RNA splicing	Group I intron splicing	GO:0000372
RNA splicing	Group II intron splicing	GO:0000373
RNA splicing	Group III intron splicing	GO:0000374
RNA splicing	MATa1 (A1) pre-mRNA splicing	GO:0006377
RNA splicing	Prp19 complex	GO:0000974
RNA splicing	RNA splicing	GO:0008380
RNA splicing	RNA splicing, via endonucleolytic cleavage and ligation	GO:0000394
RNA splicing	RNA splicing, via transesterification reactions	GO:0000375
RNA splicing	RNA splicing, via transesterification reactions with bulged adenosine as nucleophile	GO:0000377
RNA splicing	RNA splicing, via transesterification reactions with guanosine as nucleophile	GO:0000376
RNA splicing	alignment of 3' and 5' splice sites of mRNA	GO:0034403
RNA splicing	alternative mRNA splicing, via spliceosome	GO:0000380
RNA splicing	cis assembly of pre-catalytic spliceosome	GO:0000354
RNA splicing	first U12-type spliceosomal transesterification activity	GO:0000363
RNA splicing	first U2-type spliceosomal transesterification activity	GO:0000362
RNA splicing	first spliceosomal transesterification activity	GO:0000384
RNA splicing	formation of quadruple SL/U4/U5/U6 snRNP	GO:0000353
RNA splicing	generation of catalytic spliceosome for first transesterification step	GO:0000349
RNA splicing	generation of catalytic spliceosome for second transesterification step	GO:0000350
RNA splicing	intergenic mRNA trans splicing	GO:0000366
RNA splicing	mRNA cis splicing, via spliceosome	GO:0045292
RNA splicing	mRNA splicing	GO:0006371
RNA splicing	mRNA splicing, via endonucleolytic cleavage and ligation	GO:0070054
RNA splicing	mRNA splicing, via spliceosome	GO:0000398
RNA splicing	mRNA trans splicing, SL addition	GO:0045291
RNA splicing	mRNA trans splicing, via spliceosome	GO:0000365
RNA splicing	negative regulation of RNA splicing	GO:0033119
RNA splicing	negative regulation of mRNA splicing, via spliceosome	GO:0048025
RNA splicing	non-intein-mediated protein splicing	GO:0030909
RNA splicing	nuclear mRNA surveillance of spliceosomal pre-mRNA splicing	GO:0071030
RNA splicing	positive regulation of RNA splicing	GO:0033120
RNA splicing	positive regulation of mRNA splicing, via spliceosome	GO:0048026
RNA splicing	regulation of RNA splicing	GO:0043484
RNA splicing	regulation of alternative mRNA splicing, via spliceosome	GO:0000381
RNA splicing	regulation of mRNA splicing, via spliceosome	GO:0048024
RNA splicing	second U12-type spliceosomal transesterification activity	GO:0000367
RNA splicing	second U2-type spliceosomal transesterification activity	GO:0000364
RNA splicing	second spliceosomal transesterification activity	GO:0000386
RNA splicing	snoRNA splicing	GO:0034247
RNA splicing	spliceosomal complex assembly	GO:0000245
RNA splicing	spliceosomal complex disassembly	GO:0000390
RNA splicing	spliceosomal conformational changes to generate catalytic conformation	GO:0000393
RNA splicing	spliceosomal snRNP assembly	GO:0000387
RNA splicing	spliceosomal tri-snRNP complex assembly	GO:0000244
RNA splicing	spliceosome conformational change to release U4 (or U4atac) and U1 (or U11)	GO:0000388
RNA splicing	splicing factor protein import into nucleus	GO:0035048
RNA splicing	trans assembly of SL-containing precatalytic spliceosome	GO:0000352
RNA interference	antisense RNA metabolic process	GO:0042868
RNA interference	antisense RNA transcript catabolic process	GO:0071041
RNA interference	antisense RNA transcription	GO:0009300
retina development	eye photoreceptor cell development	GO:0042462
retina development	eye photoreceptor cell development	GO:0042462
respiration	alternative respiration	GO:0010230
reproduction	acquisition of reproductive competence	GO:0010049
reproduction	cellular process involved in reproduction	GO:0048610
reproduction	cellular process involved in reproduction in multicellular organism	GO:0022412
reproduction	developmental process involved in reproduction	GO:0003006
reproduction	entry into reproductive diapause	GO:0055116
reproduction	exit from reproductive diapause	GO:0071983
reproduction	maintenance of reproductive diapause	GO:0071984
reproduction	multicellular organism reproduction	GO:0032504
reproduction	multicellular organismal reproductive behavior	GO:0033057
reproduction	multicellular organismal reproductive process	GO:0048609
reproduction	negative regulation of reproductive process	GO:2000242
reproduction	positive regulation of reproductive process	GO:2000243
reproduction	regulation of reproductive process	GO:2000241
reproduction	regulation of timing of transition from vegetative to reproductive phase	GO:0048510
reproduction	reproduction	GO:0000003
reproduction	reproduction of a single-celled organism	GO:0032505
reproduction	reproductive behavior	GO:0019098
reproduction	reproductive blastospore formation	GO:0034299
reproduction	reproductive process	GO:0022414
reproduction	reproductive process in single-celled organism	GO:0022413
reproduction	reproductive sporulation	GO:0048622
reproduction	reproductive structure development	GO:0048608
reproduction	reproductive system development	GO:0061458
pyrimidine metabolism	pyrimidine-containing compound metabolic process	GO:0072527		'de novo' pyrimidine nucleobase biosynthetic process	
pyrimidine metabolism	negative regulation of pyrimidine nucleobase metabolic process	GO:0045984
pyrimidine metabolism	negative regulation of pyrimidine nucleotide biosynthetic process	GO:1900398
pyrimidine metabolism	positive regulation of pyrimidine nucleobase metabolic process	GO:0045985
pyrimidine metabolism	positive regulation of pyrimidine nucleotide biosynthetic process	GO:1900399
pyrimidine metabolism	pyrimidine deoxyribonucleoside biosynthetic process	GO:0046126
pyrimidine metabolism	pyrimidine deoxyribonucleoside catabolic process	GO:0046127
pyrimidine metabolism	pyrimidine deoxyribonucleoside diphosphate biosynthetic process	GO:0009197
pyrimidine metabolism	pyrimidine deoxyribonucleoside diphosphate catabolic process	GO:0009198
pyrimidine metabolism	pyrimidine deoxyribonucleoside diphosphate metabolic process	GO:0009196
pyrimidine metabolism	pyrimidine deoxyribonucleoside interconversion	GO:0019690
pyrimidine metabolism	pyrimidine deoxyribonucleoside metabolic process	GO:0046125
pyrimidine metabolism	pyrimidine deoxyribonucleoside monophosphate biosynthetic process	GO:0009177
pyrimidine metabolism	pyrimidine deoxyribonucleoside monophosphate catabolic process	GO:0009178
pyrimidine metabolism	pyrimidine deoxyribonucleoside monophosphate metabolic process	GO:0009176
pyrimidine metabolism	pyrimidine deoxyribonucleoside salvage	GO:0043099
pyrimidine metabolism	pyrimidine deoxyribonucleoside triphosphate biosynthetic process	GO:0009212
pyrimidine metabolism	pyrimidine deoxyribonucleoside triphosphate catabolic process	GO:0009213
pyrimidine metabolism	pyrimidine deoxyribonucleoside triphosphate metabolic process	GO:0009211
pyrimidine metabolism	pyrimidine deoxyribonucleotide biosynthetic process	GO:0009221
pyrimidine metabolism	pyrimidine deoxyribonucleotide catabolic process	GO:0009223
pyrimidine metabolism	pyrimidine deoxyribonucleotide interconversion	GO:0015955
pyrimidine metabolism	pyrimidine deoxyribonucleotide metabolic process	GO:0009219
pyrimidine metabolism	pyrimidine deoxyribonucleotide salvage	GO:0010139
pyrimidine metabolism	pyrimidine dimer repair	GO:0006290
pyrimidine metabolism	pyrimidine dimer repair by nucleotide-excision repair	GO:0000720
pyrimidine metabolism	pyrimidine metabolic process	GO:0006205
pyrimidine metabolism	pyrimidine nucleobase biosynthetic process	GO:0019856
pyrimidine metabolism	pyrimidine nucleobase catabolic process	GO:0006208
pyrimidine metabolism	pyrimidine nucleobase fermentation	GO:0043466
pyrimidine metabolism	pyrimidine nucleobase metabolic process	GO:0006206
pyrimidine metabolism	pyrimidine nucleobase salvage	GO:0043100
pyrimidine metabolism	pyrimidine nucleobase transport	GO:0015855
pyrimidine metabolism	pyrimidine nucleoside biosynthetic process	GO:0046134
pyrimidine metabolism	pyrimidine nucleoside catabolic process	GO:0046135
pyrimidine metabolism	pyrimidine nucleoside diphosphate biosynthetic process	GO:0009139
pyrimidine metabolism	pyrimidine nucleoside diphosphate catabolic process	GO:0009140
pyrimidine metabolism	pyrimidine nucleoside diphosphate metabolic process	GO:0009138
pyrimidine metabolism	pyrimidine nucleoside interconversion	GO:0019689
pyrimidine metabolism	pyrimidine nucleoside metabolic process	GO:0006213
pyrimidine metabolism	pyrimidine nucleoside monophosphate biosynthetic process	GO:0009130
pyrimidine metabolism	pyrimidine nucleoside monophosphate catabolic process	GO:0009131
pyrimidine metabolism	pyrimidine nucleoside monophosphate metabolic process	GO:0009129
pyrimidine metabolism	pyrimidine nucleoside salvage	GO:0043097
pyrimidine metabolism	pyrimidine nucleoside transport	GO:0015864
pyrimidine metabolism	pyrimidine nucleoside triphosphate biosynthetic process	GO:0009148
pyrimidine metabolism	pyrimidine nucleoside triphosphate catabolic process	GO:0009149
pyrimidine metabolism	pyrimidine nucleoside triphosphate metabolic process	GO:0009147
pyrimidine metabolism	pyrimidine nucleotide biosynthetic process	GO:0006221
pyrimidine metabolism	pyrimidine nucleotide catabolic process	GO:0006244
pyrimidine metabolism	pyrimidine nucleotide interconversion	GO:0015953
pyrimidine metabolism	pyrimidine nucleotide metabolic process	GO:0006220
pyrimidine metabolism	pyrimidine nucleotide salvage	GO:0032262
pyrimidine metabolism	pyrimidine nucleotide transport	GO:0006864
pyrimidine metabolism	pyrimidine nucleotide-sugar transport	GO:0015781
pyrimidine metabolism	pyrimidine ribonucleoside biosynthetic process	GO:0046132
pyrimidine metabolism	pyrimidine ribonucleoside catabolic process	GO:0046133
pyrimidine metabolism	pyrimidine ribonucleoside diphosphate biosynthetic process	GO:0009194
pyrimidine metabolism	pyrimidine ribonucleoside diphosphate catabolic process	GO:0009195
pyrimidine metabolism	pyrimidine ribonucleoside diphosphate metabolic process	GO:0009193
pyrimidine metabolism	pyrimidine ribonucleoside metabolic process	GO:0046131
pyrimidine metabolism	pyrimidine ribonucleoside monophosphate biosynthetic process	GO:0009174
pyrimidine metabolism	pyrimidine ribonucleoside monophosphate catabolic process	GO:0009175
pyrimidine metabolism	pyrimidine ribonucleoside monophosphate metabolic process	GO:0009173
pyrimidine metabolism	pyrimidine ribonucleoside triphosphate biosynthetic process	GO:0009209
pyrimidine metabolism	pyrimidine ribonucleoside triphosphate catabolic process	GO:0009210
pyrimidine metabolism	pyrimidine ribonucleoside triphosphate metabolic process	GO:0009208
pyrimidine metabolism	pyrimidine ribonucleotide biosynthetic process	GO:0009220
pyrimidine metabolism	pyrimidine ribonucleotide catabolic process	GO:0009222
pyrimidine metabolism	pyrimidine ribonucleotide interconversion	GO:0015954
pyrimidine metabolism	pyrimidine ribonucleotide metabolic process	GO:0009218
pyrimidine metabolism	pyrimidine ribonucleotide salvage	GO:0010138
pyrimidine metabolism	pyrimidine-containing compound biosynthetic process	GO:0072528
pyrimidine metabolism	pyrimidine-containing compound catabolic process	GO:0072529
pyrimidine metabolism	pyrimidine-containing compound metabolic process	GO:0072527
pyrimidine metabolism	pyrimidine-containing compound salvage	GO:0008655
pyrimidine metabolism	pyrimidine-containing compound transmembrane transport	GO:0072531
pyrimidine metabolism	regulation of pyrimidine nucleobase metabolic process	GO:0006142
pyrimidine metabolism	regulation of pyrimidine nucleoside transport	GO:0032246
pyrimidine metabolism	regulation of pyrimidine nucleotide biosynthetic process	GO:1900397
purine metabolism	adenosine biosynthetic process	GO:0046086
purine metabolism	adenosine catabolic process	GO:0006154
purine metabolism	adenosine deaminase reaction	GO:0006155
purine metabolism	adenosine metabolic process	GO:0046085
purine metabolism	adenosine receptor signaling pathway	GO:0001973
purine metabolism	adenosine salvage	GO:0006169
purine metabolism	adenosine to inosine editing	GO:0006382
purine metabolism	adenosine transport	GO:0032238
purine metabolism	cellular response to purine-containing compound	GO:0071415
purine metabolism	cyclic purine nucleotide metabolic process	GO:0052652
purine metabolism	inosine biosynthetic process	GO:0046103
purine metabolism	inosine catabolic process	GO:0006148
purine metabolism	inosine metabolic process	GO:0046102
purine metabolism	inosine salvage	GO:0006190
purine metabolism	inosine transport	GO:0035340
purine metabolism	negative regulation of purine nucleobase metabolic process	GO:0045982
purine metabolism	negative regulation of purine nucleoside transport	GO:0032247
purine metabolism	negative regulation of purine nucleotide biosynthetic process	GO:1900372
purine metabolism	negative regulation of purine nucleotide catabolic process	GO:0033122
purine metabolism	negative regulation of purine nucleotide metabolic process	GO:1900543
purine metabolism	positive regulation of purine nucleobase metabolic process	GO:0045983
purine metabolism	positive regulation of purine nucleoside transport	GO:0032248
purine metabolism	positive regulation of purine nucleotide biosynthetic process	GO:1900373
purine metabolism	positive regulation of purine nucleotide catabolic process	GO:0033123
purine metabolism	positive regulation of purine nucleotide metabolic process	GO:1900544
purine metabolism	purine alkaloid biosynthetic process	GO:0009711
purine metabolism	purine alkaloid metabolic process	GO:0046446
purine metabolism	purine deoxyribonucleoside biosynthetic process	GO:0046123
purine metabolism	purine deoxyribonucleoside catabolic process	GO:0046124
purine metabolism	purine deoxyribonucleoside diphosphate biosynthetic process	GO:0009183
purine metabolism	purine deoxyribonucleoside diphosphate catabolic process	GO:0009184
purine metabolism	purine deoxyribonucleoside diphosphate metabolic process	GO:0009182
purine metabolism	purine deoxyribonucleoside interconversion	GO:0019688
purine metabolism	purine deoxyribonucleoside metabolic process	GO:0046122
purine metabolism	purine deoxyribonucleoside monophosphate biosynthetic process	GO:0009171
purine metabolism	purine deoxyribonucleoside monophosphate catabolic process	GO:0009172
purine metabolism	purine deoxyribonucleoside monophosphate metabolic process	GO:0009170
purine metabolism	purine deoxyribonucleoside salvage	GO:0043098
purine metabolism	purine deoxyribonucleoside triphosphate biosynthetic process	GO:0009216
purine metabolism	purine deoxyribonucleoside triphosphate catabolic process	GO:0009217
purine metabolism	purine deoxyribonucleoside triphosphate metabolic process	GO:0009215
purine metabolism	purine deoxyribonucleotide biosynthetic process	GO:0009153
purine metabolism	purine deoxyribonucleotide catabolic process	GO:0009155
purine metabolism	purine deoxyribonucleotide interconversion	GO:0015952
purine metabolism	purine deoxyribonucleotide metabolic process	GO:0009151
purine metabolism	purine metabolic process	GO:0006143
purine metabolism	purine nucleobase biosynthetic process	GO:0009113
purine metabolism	purine nucleobase catabolic process	GO:0006145
purine metabolism	purine nucleobase metabolic process	GO:0006144
purine metabolism	purine nucleobase salvage	GO:0043096
purine metabolism	purine nucleobase transport	GO:0006863
purine metabolism	purine nucleosidase reaction	GO:0006153
purine metabolism	purine nucleoside biosynthetic process	GO:0042451
purine metabolism	purine nucleoside bisphosphate biosynthetic process	GO:0034033
purine metabolism	purine nucleoside bisphosphate catabolic process	GO:0034034
purine metabolism	purine nucleoside bisphosphate metabolic process	GO:0034032
purine metabolism	purine nucleoside catabolic process	GO:0006152
purine metabolism	purine nucleoside diphosphate biosynthetic process	GO:0009136
purine metabolism	purine nucleoside diphosphate catabolic process	GO:0009137
purine metabolism	purine nucleoside diphosphate metabolic process	GO:0009135
purine metabolism	purine nucleoside interconversion	GO:0019686
purine metabolism	purine nucleoside metabolic process	GO:0042278
purine metabolism	purine nucleoside monophosphate biosynthetic process	GO:0009127
purine metabolism	purine nucleoside monophosphate catabolic process	GO:0009128
purine metabolism	purine nucleoside monophosphate metabolic process	GO:0009126
purine metabolism	purine nucleoside transmembrane transport	GO:0015860
purine metabolism	purine nucleoside triphosphate biosynthetic process	GO:0009145
purine metabolism	purine nucleoside triphosphate catabolic process	GO:0009146
purine metabolism	purine nucleoside triphosphate metabolic process	GO:0009144
purine metabolism	purine nucleotide biosynthetic process	GO:0006164
purine metabolism	purine nucleotide catabolic process	GO:0006195
purine metabolism	purine nucleotide interconversion	GO:0015950
purine metabolism	purine nucleotide metabolic process	GO:0006163
purine metabolism	purine nucleotide salvage	GO:0032261
purine metabolism	purine nucleotide transport	GO:0015865
purine metabolism	purine nucleotide-sugar transport	GO:0036079
purine metabolism	purine ribonucleoside biosynthetic process	GO:0046129
purine metabolism	purine ribonucleoside bisphosphate biosynthetic process	GO:0034036
purine metabolism	purine ribonucleoside bisphosphate catabolic process	GO:0034037
purine metabolism	purine ribonucleoside bisphosphate metabolic process	GO:0034035
purine metabolism	purine ribonucleoside catabolic process	GO:0046130
purine metabolism	purine ribonucleoside diphosphate biosynthetic process	GO:0009180
purine metabolism	purine ribonucleoside diphosphate catabolic process	GO:0009181
purine metabolism	purine ribonucleoside diphosphate metabolic process	GO:0009179
purine metabolism	purine ribonucleoside metabolic process	GO:0046128
purine metabolism	purine ribonucleoside monophosphate biosynthetic process	GO:0009168
purine metabolism	purine ribonucleoside monophosphate catabolic process	GO:0009169
purine metabolism	purine ribonucleoside monophosphate metabolic process	GO:0009167
purine metabolism	purine ribonucleoside salvage	GO:0006166
purine metabolism	purine ribonucleoside triphosphate biosynthetic process	GO:0009206
purine metabolism	purine ribonucleoside triphosphate catabolic process	GO:0009207
purine metabolism	purine ribonucleoside triphosphate metabolic process	GO:0009205
purine metabolism	purine ribonucleotide biosynthetic process	GO:0009152
purine metabolism	purine ribonucleotide catabolic process	GO:0009154
purine metabolism	purine ribonucleotide interconversion	GO:0015951
purine metabolism	purine ribonucleotide metabolic process	GO:0009150
purine metabolism	purine ribonucleotide transport	GO:0015868
purine metabolism	purine-containing compound biosynthetic process	GO:0072522
purine metabolism	purine-containing compound catabolic process	GO:0072523
purine metabolism	purine-containing compound metabolic process	GO:0072521
purine metabolism	purine-containing compound salvage	GO:0043101
purine metabolism	purine-containing compound transmembrane transport	GO:0072530
purine metabolism	purine/pyrimidine nucleoside diphosphate reduction	GO:0006162
purine metabolism	purinergic nucleotide receptor signaling pathway	GO:0035590
purine metabolism	purinergic receptor signaling pathway	GO:0035587
purine metabolism	regulation of purine nucleobase metabolic process	GO:0006141
