Roche CV	GO term name	GO term ID	
zinc ion homeostasis	zinc ion homeostasis	GO:0055069
zinc ion homeostasis	zinc ion transmembrane import	GO:0071578
zinc ion homeostasis	zinc ion transmembrane transport	GO:0071577
zinc ion homeostasis	zinc ion transport	GO:0006829
zinc ion homeostasis	zinc potentiation of synaptic transmission, glycinergic	GO:0060095
yeast	flocculation	GO:0000128
yeast	incipient cellular bud site	GO:0000131
xenobiotic	xenobiotic catabolic process	GO:0042178
xenobiotic	xenobiotic glucuronidation	GO:0052697
xenobiotic	xenobiotic metabolic process	GO:0006805
xenobiotic	xenobiotic transport	GO:0042908
wound healing	clearance of damaged tissue involved in inflammatory response wound healing	GO:0002247
wound healing	connective tissue replacement involved in inflammatory response wound healing	GO:0002248
wound healing	negative regulation of vascular wound healing	GO:0061044
wound healing	negative regulation of wound healing	GO:0061045
wound healing	positive regulation of vascular wound healing	GO:0035470
wound healing	positive regulation of wound healing	GO:0090303
wound healing	regulation of vascular wound healing	GO:0061043
wound healing	regulation of wound healing	GO:0061041
wound healing	wound healing	GO:0042060
wound healing	wound healing involved in inflammatory response	GO:0002246
wound healing	wound healing, spreading of cells	GO:0044319
wound healing	wound healing, spreading of epidermal cells	GO:0035313
Wnt pathway	Wnt protein secretion	GO:0061355
Wnt pathway	Wnt receptor catabolic process	GO:0038018
Wnt pathway	Wnt receptor internalization	GO:0038017
Wnt pathway	Wnt receptor recycling	GO:0038019
Wnt pathway	Wnt signaling pathway	GO:0016055
Wnt pathway	Wnt signaling pathway involved in animal/vegetal axis specification	GO:0060833
Wnt pathway	Wnt signaling pathway involved in digestive tract morphogenesis	GO:0044333
Wnt pathway	Wnt signaling pathway involved in dorsal/ventral axis specification	GO:0044332
Wnt pathway	Wnt signaling pathway involved in forebrain neuroblast division	GO:0021874
Wnt pathway	Wnt signaling pathway involved in heart development	GO:0003306
Wnt pathway	Wnt signaling pathway involved in kidney development	GO:0061289
Wnt pathway	Wnt signaling pathway involved in mammary gland specification	GO:0060593
Wnt pathway	Wnt signaling pathway involved in primitive streak formation	GO:0090011
Wnt pathway	Wnt signaling pathway involved in regulation of cell proliferation in dorsal spinal cord	GO:0021922
Wnt pathway	Wnt signaling pathway involved in somitogenesis	GO:0090244
Wnt pathway	Wnt signaling pathway involved in wound healing, spreading of epidermal cells	GO:0035659
Wnt pathway	Wnt signaling pathway, calcium modulating pathway	GO:0007223
Wnt pathway	Wnt signaling pathway, planar cell polarity pathway	GO:0060071
Wnt pathway	Wnt signaling pathway, regulating spindle positioning	GO:0060069
Wnt pathway	Wnt-activated signaling pathway involved in forebrain neuron fate commitment	GO:0021881
Wnt pathway	canonical Wnt signaling pathway	GO:0060070
Wnt pathway	canonical Wnt signaling pathway involved in cardiac muscle cell fate commitment	GO:0061317
Wnt pathway	canonical Wnt signaling pathway involved in cardiac neural crest cell differentiation involved in heart development	GO:0061310
Wnt pathway	canonical Wnt signaling pathway involved in heart development	GO:0061316
Wnt pathway	canonical Wnt signaling pathway involved in mesenchymal stem cell differentiation	GO:0044338
Wnt pathway	canonical Wnt signaling pathway involved in mesonephric nephron development	GO:0061293
Wnt pathway	canonical Wnt signaling pathway involved in mesonephros development	GO:0061292
Wnt pathway	canonical Wnt signaling pathway involved in metanephric kidney development	GO:0061290
Wnt pathway	canonical Wnt signaling pathway involved in negative regulation of apoptotic process	GO:0044336
Wnt pathway	canonical Wnt signaling pathway involved in neural crest cell differentiation	GO:0044335
Wnt pathway	canonical Wnt signaling pathway involved in neural plate anterior/posterior pattern formation	GO:0060823
Wnt pathway	canonical Wnt signaling pathway involved in osteoblast differentiation	GO:0044339
Wnt pathway	canonical Wnt signaling pathway involved in positive regulation of apoptotic process	GO:0044337
Wnt pathway	canonical Wnt signaling pathway involved in positive regulation of cardiac muscle cell proliferation	GO:0061315
Wnt pathway	canonical Wnt signaling pathway involved in positive regulation of cardiac outflow tract cell proliferation	GO:0061324
Wnt pathway	canonical Wnt signaling pathway involved in positive regulation of cell-cell adhesion	GO:0044329
Wnt pathway	canonical Wnt signaling pathway involved in positive regulation of endothelial cell migration	GO:0044328
Wnt pathway	canonical Wnt signaling pathway involved in positive regulation of epithelial to mesenchymal transition	GO:0044334
Wnt pathway	canonical Wnt signaling pathway involved in positive regulation of secondary heart field cardioblast proliferation	GO:0003267
Wnt pathway	canonical Wnt signaling pathway involved in positive regulation of wound healing	GO:0044330
Wnt pathway	canonical Wnt signaling pathway involved in regulation of cell proliferation	GO:0044340
Wnt pathway	canonical Wnt signaling pathway involved in regulation of type B pancreatic cell proliferation	GO:0044343
Wnt pathway	canonical Wnt signaling pathway involved in ureteric bud branching	GO:0061291
Wnt pathway	negative regulation of Wnt protein secretion	GO:0061358
Wnt pathway	negative regulation of Wnt signaling pathway	GO:0030178
Wnt pathway	negative regulation of Wnt signaling pathway by Wnt receptor internalization	GO:0038012
Wnt pathway	negative regulation of Wnt signaling pathway involved in digestive tract morphogenesis	GO:2000057
Wnt pathway	negative regulation of Wnt signaling pathway involved in dorsal/ventral axis specification	GO:2000054
Wnt pathway	negative regulation of Wnt signaling pathway involved in heart development	GO:0003308
Wnt pathway	negative regulation of Wnt signaling pathway, calcium modulating pathway	GO:0045812
Wnt pathway	negative regulation of anterior neural cell fate commitment of the neural plate by Wnt signaling pathway	GO:0022002
Wnt pathway	negative regulation of canonical Wnt signaling pathway	GO:0090090
Wnt pathway	negative regulation of canonical Wnt signaling pathway involved in cardiac muscle cell fate commitment	GO:1901296
Wnt pathway	negative regulation of canonical Wnt signaling pathway involved in controlling type B pancreatic cell proliferation	GO:2000080
Wnt pathway	negative regulation of canonical Wnt signaling pathway involved in neural crest cell differentiation	GO:0072336
Wnt pathway	negative regulation of canonical Wnt signaling pathway involved in neural plate anterior/posterior pattern formation	GO:0060829
Wnt pathway	negative regulation of heart induction by canonical Wnt signaling pathway	GO:0003136
Wnt pathway	negative regulation of non-canonical Wnt signaling pathway	GO:2000051
Wnt pathway	negative regulation of non-canonical Wnt signaling pathway via JNK cascade	GO:1901230
Wnt pathway	non-canonical Wnt signaling pathway	GO:0035567
Wnt pathway	non-canonical Wnt signaling pathway involved in heart development	GO:0061341
Wnt pathway	non-canonical Wnt signaling pathway via JNK cascade	GO:0038031
Wnt pathway	non-canonical Wnt signaling pathway via MAPK cascade	GO:0038030
Wnt pathway	positive regulation of Wnt protein secretion	GO:0061357
Wnt pathway	positive regulation of Wnt signaling pathway	GO:0030177
Wnt pathway	positive regulation of Wnt signaling pathway by BMP signaling pathway	GO:0060804
Wnt pathway	positive regulation of Wnt signaling pathway by Wnt receptor internalization	GO:0038013
Wnt pathway	positive regulation of Wnt signaling pathway by establishment of Wnt protein localization to extracellular region	GO:0035593
Wnt pathway	positive regulation of Wnt signaling pathway involved in dorsal/ventral axis specification	GO:2000055
Wnt pathway	positive regulation of Wnt signaling pathway, calcium modulating pathway	GO:0045813
Wnt pathway	positive regulation of Wnt signaling pathway, planar cell polarity pathway	GO:2000096
Wnt pathway	positive regulation of canonical Wnt signaling pathway	GO:0090263
Wnt pathway	positive regulation of canonical Wnt signaling pathway involved in cardiac muscle cell fate commitment	GO:1901297
Wnt pathway	positive regulation of canonical Wnt signaling pathway involved in controlling type B pancreatic cell proliferation	GO:2000081
Wnt pathway	positive regulation of canonical Wnt signaling pathway involved in neural crest cell differentiation	GO:0072381
Wnt pathway	positive regulation of heart induction by negative regulation of canonical Wnt signaling pathway	GO:0090082
Wnt pathway	positive regulation of non-canonical Wnt signaling pathway	GO:2000052
Wnt pathway	positive regulation of non-canonical Wnt signaling pathway via JNK cascade	GO:1901231
Wnt pathway	positive regulation of posterior neural plate formation by Wnt signaling pathway	GO:0090021
Wnt pathway	receptor internalization involved in canonical Wnt signaling pathway	GO:2000286
Wnt pathway	regulation of Wnt protein secretion	GO:0061356
Wnt pathway	regulation of Wnt signaling pathway	GO:0030111
Wnt pathway	regulation of Wnt signaling pathway by Wnt protein secretion	GO:0061359
Wnt pathway	regulation of Wnt signaling pathway involved in digestive tract morphogenesis	GO:2000056
Wnt pathway	regulation of Wnt signaling pathway involved in dorsal/ventral axis specification	GO:2000053
Wnt pathway	regulation of Wnt signaling pathway involved in heart development	GO:0003307
Wnt pathway	regulation of Wnt signaling pathway, calcium modulating pathway	GO:0008591
Wnt pathway	regulation of Wnt signaling pathway, planar cell polarity pathway	GO:2000095
Wnt pathway	regulation of canonical Wnt signaling pathway	GO:0060828
Wnt pathway	regulation of canonical Wnt signaling pathway involved in cardiac muscle cell fate commitment	GO:1901295
Wnt pathway	regulation of canonical Wnt signaling pathway involved in controlling type B pancreatic cell proliferation	GO:2000079
Wnt pathway	regulation of canonical Wnt signaling pathway involved in neural crest cell differentiation	GO:0072335
Wnt pathway	regulation of canonical Wnt signaling pathway involved in neural plate anterior/posterior pattern formation	GO:0060827
Wnt pathway	regulation of cell adhesion involved in heart morphogenesis by non-canonical Wnt signaling pathway	GO:0061342
Wnt pathway	regulation of hair cycle by canonical Wnt signaling pathway	GO:0060901
Wnt pathway	regulation of heart induction by regulation of canonical Wnt signaling pathway	GO:0090081
Wnt pathway	regulation of non-canonical Wnt signaling pathway	GO:2000050
Wnt pathway	regulation of non-canonical Wnt signaling pathway via JNK cascade	GO:1901229
vitamin metabolism	biotin carboxyl carrier protein biosynthetic process	GO:0042966
vitamin metabolism	biotin catabolic process	GO:0042367
vitamin metabolism	biotin metabolic process	GO:0006768
vitamin metabolism	biotin transport	GO:0015878
vitamin K	vitamin K biosynthetic process	GO:0042371
vitamin K	vitamin K catabolic process	GO:0042377
vitamin K	vitamin K metabolic process	GO:0042373
vitamin D	vitamin D biosynthetic process	GO:0042368
vitamin D	vitamin D catabolic process	GO:0042369
vitamin D	vitamin D metabolic process	GO:0042359
vitamin D	vitamin D receptor signaling pathway	GO:0070561
vitamin D	vitamin D2 metabolic process	GO:0070639
vitamin D	vitamin D3 metabolic process	GO:0070640
vitamin D	vitamin D4 metabolic process	GO:0070641
vitamin D	vitamin D5 metabolic process	GO:0070642
vitamin C	ascorbate stabilization	GO:0000044
vitamin A	vitamin A biosynthetic process	GO:0035238
vitamin A	vitamin A import	GO:0071939
vitamin A	vitamin A metabolic process	GO:0006776
vitamin A	vitamin A transport	GO:0071938
virus	catabolism by virus of host DNA	GO:0039637
virus	caveolin-mediated endocytosis of virus by host cell	GO:0075513
virus	clathrin-mediated endocytosis of virus by host cell	GO:0075512
virus	cleavage by virus of host mRNA	GO:0039599
virus	coreceptor-mediated virion attachment to host cell	GO:0046814
virus	cytolysis by virus of host cell	GO:0044659
virus	cytolysis by virus via pore formation in host cell membrane	GO:0044660
virus	cytolysis by virus via suppression of host peptidoglycan biosynthetic process	GO:0039640
virus	cytoplasmic pattern recognition receptor signaling pathway in response to virus	GO:0039528
virus	defense response to virus	GO:0051607
virus	detection of virus	GO:0009597
virus	disruption by virus of host cell	GO:0044661
virus	disruption by virus of host cell membrane	GO:0044662
virus	early viral transcription	GO:0019085
virus	endocytosis involved in viral entry into host cell	GO:0075509
virus	endosome lysis involved in viral entry into host cell	GO:0075514
virus	endosome membrane permeabilization involved in viral entry into host cell	GO:0075502
virus	entry of intact viral capsid into host nucleus through nuclear pore complex	GO:0075505
virus	entry of viral genome into host nucleus through nuclear pore complex via importin	GO:0075506
virus	entry of viral genome into host nucleus via docking of viral capsid to the nuclear pore complex and injection of viral genome	GO:0075507
virus	entry of viral genome into host nucleus via retainment of capsid in nuclear pore complex and release of genome into nucleoplasm	GO:0075508
virus	establishment of integrated proviral latency	GO:0075713
virus	establishment of viral latency	GO:0019043
virus	evasion or tolerance of host defenses by virus	GO:0019049
virus	exit of virus from host cell nucleus by nuclear egress	GO:0046802
virus	fusion of virus membrane with host macropinosome membrane	GO:0075503
virus	fusion of virus membrane with host plasma membrane	GO:0019064
virus	genome retention in viral capsid	GO:0046815
virus	immortalization of host cell by virus	GO:0019088
virus	induction by virus of catabolism of host mRNA	GO:0039595
virus	induction by virus of host apoptotic process	GO:0019051
virus	induction by virus of host autophagy	GO:0039520
virus	induction by virus of host cell-cell fusion	GO:0006948
virus	induction by virus of host endonucleolytic cleavage-dependent mRNA catabolic process	GO:0039600
virus	induction by virus of host endoribonuclease activity	GO:0039597
virus	induction by virus of host nuclear polyadenylation-dependent mRNA catabolic process	GO:0039598
virus	induction by virus of host protein phosphorylation	GO:0039614
virus	initiation of viral infection	GO:0019059
virus	intracellular transport of viral protein in host cell	GO:0019060
virus	intracellular transport of virus	GO:0075733
virus	late viral transcription	GO:0019086
virus	latent virus replication	GO:0019045
virus	lytic vacuole organization	GO:0080171
virus	lytic viral budding	GO:0019078
virus	lytic viral life cycle	GO:0030068
virus	lytic virus budding from ER membrane	GO:0046757
virus	lytic virus budding from Golgi membrane	GO:0046758
virus	lytic virus budding from plasma membrane	GO:0046759
virus	macropinocytosis involved in viral entry into host cell	GO:0075510
virus	macropinosomal membrane permeabilization involved in viral entry into host cell	GO:0075504
virus	macropinosome lysis involved in viral entry into host cell	GO:0075511
virus	maintenance of viral latency	GO:0019044
virus	microtubule-dependent intracellular transport of viral material	GO:0075519
virus	microtubule-dependent intracellular transport of viral material towards nucleus	GO:0075521
virus	modification by virus of host mRNA processing	GO:0046778
virus	modification by virus of host polysomes	GO:0046783
virus	modulation by host of viral transcription	GO:0043921
virus	modulation by virus of host PP1 activity	GO:0039586
virus	modulation by virus of host apoptotic process	GO:0039526
virus	modulation by virus of host autophagy	GO:0039519
virus	modulation by virus of host catalytic activity	GO:0039516
virus	modulation by virus of host chromatin organization	GO:0039525
virus	modulation by virus of host molecular function	GO:0039506
virus	modulation by virus of host morphology or physiology	GO:0019048
virus	modulation by virus of host process	GO:0019054
virus	modulation by virus of host protein dephosphorylation	GO:0039596
virus	modulation by virus of host protein phosphorylation	GO:0039612
virus	modulation by virus of host transcription	GO:0019056
virus	modulation by virus of host translation	GO:0019057
virus	negative regulation by host of viral transcription	GO:0043922
virus	negative regulation of defense response to virus	GO:0050687
virus	negative regulation of defense response to virus by host	GO:0050689
virus	negative regulation of intracellular transport of viral material	GO:1901253
virus	negative regulation of single stranded viral RNA replication via double stranded DNA intermediate	GO:0045869
virus	negative regulation of spread of virus in host, cell to cell	GO:1900202
virus	negative regulation of viral entry into host cell	GO:0046597
virus	negative regulation of viral genome replication	GO:0045071
virus	negative regulation of viral process	GO:0048525
virus	negative regulation of viral protein levels in host cell	GO:0046725
virus	negative regulation of viral transcription	GO:0032897
virus	negative regulation of viral-induced cytoplasmic pattern recognition receptor signaling pathway	GO:0039532
virus	non-lytic viral release	GO:0046753
virus	pore-mediated entry of viral genome into host cell	GO:0044694
virus	positive regulation of apoptotic process by virus	GO:0060139
virus	positive regulation of defense response to virus by host	GO:0002230
virus	positive regulation of intracellular transport of viral material	GO:1901254
virus	positive regulation of single stranded viral RNA replication via double stranded DNA intermediate	GO:0045870
virus	positive regulation of spread of virus in host, cell to cell	GO:1900203
virus	positive regulation of syncytium formation by virus	GO:0060141
virus	positive regulation of viral entry into host cell	GO:0046598
virus	positive regulation of viral genome replication	GO:0045070
virus	positive regulation of viral process	GO:0048524
virus	positive regulation of viral protein levels in host cell	GO:0046726
virus	positive regulation of viral transcription	GO:0050434
virus	proteolysis by virus of host translation initiation factor	GO:0039607
virus	provirus excision	GO:0032359
virus	receptor-mediated endocytosis of virus by host cell	GO:0019065
virus	receptor-mediated virion attachment to host cell	GO:0046813
virus	regulation by virus of viral protein levels in host cell	GO:0046719
virus	regulation of intracellular transport of viral material	GO:1901252
virus	regulation of single stranded viral RNA replication via double stranded DNA intermediate	GO:0045091
virus	regulation of spread of virus in host, cell to cell	GO:1900201
virus	regulation of viral entry into host cell	GO:0046596
virus	regulation of viral genome replication	GO:0045069
virus	regulation of viral process	GO:0050792
virus	regulation of viral transcription	GO:0046782
virus	regulation of viral-induced cytoplasmic pattern recognition receptor signaling pathway	GO:0039531
virus	release from viral latency	GO:0019046
virus	response to virus	GO:0009615
virus	retrotransposon nucleocapsid	GO:0000943
virus	sigma virus replication	GO:0008167
virus	suppression by virus of G2/M transition of host mitotic cell cycle	GO:0039592
virus	suppression by virus of expression of host genes with introns	GO:0046779
virus	suppression by virus of host ATP-dependent RNA helicase activity	GO:0039510
virus	suppression by virus of host IRF3 activity	GO:0039548
virus	suppression by virus of host IRF3 activity by inhibition of DNA binding	GO:0039550
virus	suppression by virus of host IRF3 activity by inhibition of IRF3 phosphorylation	GO:0039549
virus	suppression by virus of host IRF3 activity by positive regulation of IRF3 catabolic process	GO:0039551
virus	suppression by virus of host IRF7 activity	GO:0039557
virus	suppression by virus of host IRF7 activity by positive regulation of IRF7 catabolic process	GO:0039559
virus	suppression by virus of host IRF7 activity by positive regulation of IRF7 sumoylation	GO:0039558
virus	suppression by virus of host IRF9 activity	GO:0039560
virus	suppression by virus of host IRF9 activity by positive regulation of IRF9 localization to nucleus	GO:0039561
virus	suppression by virus of host ISG15 activity	GO:0039579
virus	suppression by virus of host JAK-STAT cascade	GO:0039514
virus	suppression by virus of host JAK1 activity	GO:0039576
virus	suppression by virus of host JAK1 activity by negative regulation of JAK1 phosphorylation	GO:0039577
virus	suppression by virus of host JAK1 activity via JAK1 binding	GO:0039578
virus	suppression by virus of host MAVS activity	GO:0039545
virus	suppression by virus of host MAVS activity by MAVS proteolysis	GO:0039546
virus	suppression by virus of host MDA-5 activity	GO:0039554
virus	suppression by virus of host MDA-5 activity via MDA-5 binding	GO:0039555
virus	suppression by virus of host MDA-5 signaling pathway	GO:0039539
virus	suppression by virus of host PKR activity	GO:0039580
virus	suppression by virus of host PKR activity by positive regulation of PKR catabolic process	GO:0039583
virus	suppression by virus of host PKR activity by positive regulation of PKR nuclear localization	GO:0039582
virus	suppression by virus of host PKR activity via double-stranded RNA binding	GO:0039581
virus	suppression by virus of host RIG-I K63-linked ubiquitination	GO:0039542
virus	suppression by virus of host RIG-I activity	GO:0039540
virus	suppression by virus of host RIG-I activity by RIG-I proteolysis	GO:0039544
virus	suppression by virus of host RIG-I activity by viral RNA 5' processing	GO:0039543
virus	suppression by virus of host RIG-I signaling pathway	GO:0039538
virus	suppression by virus of host RIG-I via RIG-I binding	GO:0039541
virus	suppression by virus of host RNA polymerase II activity	GO:0039523
virus	suppression by virus of host STAT activity	GO:0039562
virus	suppression by virus of host STAT1 activity	GO:0039563
virus	suppression by virus of host STAT1 activity by inhibition of DNA binding	GO:0039568
virus	suppression by virus of host STAT1 activity by negative regulation of STAT protein import into nucleus	GO:0039567
virus	suppression by virus of host STAT1 activity by negative regulation of STAT1 tyrosine phosphorylation	GO:0039571
virus	suppression by virus of host STAT1 activity by positive regulation of STAT1 catabolic process	GO:0039565
virus	suppression by virus of host STAT1 activity by tyrosine dephosphorylation of STAT1	GO:0039566
virus	suppression by virus of host STAT2 activity	GO:0039564
virus	suppression by virus of host STAT2 activity by negative regulation of STAT protein import into nucleus	GO:0039570
virus	suppression by virus of host STAT2 activity by negative regulation of STAT2 tyrosine phosphorylation	GO:0039572
virus	suppression by virus of host STAT2 activity by positive regulation of STAT2 catabolic process	GO:0039569
virus	suppression by virus of host TRAF activity	GO:0039547
virus	suppression by virus of host TRAF-mediated signal transduction	GO:0039527
virus	suppression by virus of host TYK2 activity	GO:0039574
virus	suppression by virus of host TYK2 activity by negative regulation of TYK2 tyrosine phosphorylation	GO:0039575
virus	suppression by virus of host antigen processing and presentation	GO:0039588
virus	suppression by virus of host antigen processing and presentation of peptide antigen via MHC class I	GO:0046776
virus	suppression by virus of host antigen processing and presentation of peptide antigen via MHC class II	GO:0039505
virus	suppression by virus of host apoptotic process	GO:0019050
virus	suppression by virus of host autophagy	GO:0039521
virus	suppression by virus of host catalytic activity	GO:0039513
virus	suppression by virus of host cell cycle arrest	GO:0046792
virus	suppression by virus of host cell lysis in response to superinfection	GO:0039639
virus	suppression by virus of host cell wall biogenesis	GO:0039636
virus	suppression by virus of host chemokine activity	GO:0039553
virus	suppression by virus of host complement activation	GO:0039573
virus	suppression by virus of host complement neutralization	GO:0046791
virus	suppression by virus of host cytokine activity	GO:0039518
virus	suppression by virus of host cytokine production	GO:0046775
virus	suppression by virus of host exit from mitosis	GO:0039593
virus	suppression by virus of host interferon receptor activity	GO:0039511
virus	suppression by virus of host intracellular interferon activity	GO:0046774
virus	suppression by virus of host mRNA export from nucleus	GO:0039522
virus	suppression by virus of host mRNA processing	GO:0039524
virus	suppression by virus of host mRNA splicing	GO:0046780
virus	suppression by virus of host molecular function	GO:0039507
virus	suppression by virus of host pattern recognition receptor activity	GO:0039509
virus	suppression by virus of host peptidoglycan biosynthetic process	GO:0039635
virus	suppression by virus of host protein kinase activity	GO:0039584
virus	suppression by virus of host protein phosphorylation	GO:0039613
virus	suppression by virus of host protein tyrosine kinase activity	GO:0039512
virus	suppression by virus of host receptor activity	GO:0039508
virus	suppression by virus of host tapasin activity	GO:0039591
virus	suppression by virus of host tetherin activity	GO:0039587
virus	suppression by virus of host transcription initiation from RNA polymerase II promoter	GO:0039602
virus	suppression by virus of host translation	GO:0039604
virus	suppression by virus of host translation initiation	GO:0039606
virus	suppression by virus of host translation initiation factor activity	GO:0039611
virus	suppression by virus of host translation initiation factor activity by induction of host protein dephosphorylation	GO:0039608
virus	suppression by virus of host translation termination	GO:0046773
