Roche CV	GO term name	GO term ID	
insulin metabolism	insulin receptor signaling pathway via phosphatidylinositol 3-kinase	GO:0038028
insulin metabolism	insulin secretion	GO:0030073
insulin metabolism	insulin secretion involved in cellular response to glucose stimulus	GO:0035773
insulin metabolism	insulin-like growth factor receptor signaling pathway	GO:0048009
insulin	cellular response to insulin stimulus	GO:0032869
insulin	insulin	GO:0016088
insulin	negative regulation of cellular response to insulin stimulus	GO:1900077
insulin	negative regulation of insulin receptor signaling pathway	GO:0046627
insulin	negative regulation of insulin receptor signaling pathway by insulin receptor internalization	GO:0038014
insulin	negative regulation of insulin secretion	GO:0046676
insulin	negative regulation of insulin-like growth factor receptor signaling pathway	GO:0043569
insulin	phosphatidylinositol 3-kinase cascade involved in insulin receptor signaling	GO:0035558
insulin	positive regulation of cellular response to insulin stimulus	GO:1900078
insulin	positive regulation of insulin receptor signaling pathway	GO:0046628
insulin	positive regulation of insulin receptor signaling pathway by insulin receptor internalization	GO:0038015
insulin	positive regulation of insulin secretion	GO:0032024
insulin	positive regulation of insulin-like growth factor receptor signaling pathway	GO:0043568
insulin	regulation of cellular response to insulin stimulus	GO:1900076
insulin	regulation of insulin receptor signaling pathway	GO:0046626
insulin	regulation of insulin secretion	GO:0050796
insulin	regulation of insulin-like growth factor receptor signaling pathway	GO:0043567
insulin	response to insulin	GO:0032868
inositol metabolism	inositol metabolic process	GO:0006020
inositol metabolism	inositol or phosphatidylinositol phosphorylation	GO:0046853
inositol metabolism	inositol phosphate biosynthetic process	GO:0032958
inositol metabolism	inositol phosphate catabolic process	GO:0071545
inositol metabolism	inositol phosphate dephosphorylation	GO:0046855
inositol metabolism	inositol phosphate metabolic process	GO:0043647
inositol metabolism	inositol phosphate-mediated signaling	GO:0048016
inositol metabolism	inositol phospholipid-mediated signaling	GO:0019936
inositol metabolism	inositol phosphorylation	GO:0052746
inositol metabolism	inositol trisphosphate biosynthetic process	GO:0032959
inositol metabolism	inositol trisphosphate metabolic process	GO:0032957
inositol metabolism	inositolphosphoceramide metabolic process	GO:0006673
inner ear development	inner ear development	GO:0048839
inner ear development	inner ear morphogenesis	GO:0042472
inner ear development	inner ear receptor cell development	GO:0060119
inner ear development	inner ear receptor cell differentiation	GO:0060113
inner ear development	inner ear receptor cell differentiation involved in inner ear sensory epithelium regeneration	GO:0070660
inner ear development	inner ear receptor cell fate commitment	GO:0060120
inner ear development	inner ear receptor stereocilium organization	GO:0060122
inner ear development	inner ear sensory epithelium regeneration	GO:0070659
inflammation	C-X-C chemokine receptor CXCR4 signaling pathway	GO:0038159
inflammation	NLRP3 inflammasome complex assembly	GO:0044546
inflammation	TNFSF11-mediated signaling pathway	GO:0071847
inflammation	activated CD4-positive, alpha-beta T cell proliferation	GO:0035741
inflammation	activated CD8-positive, alpha-beta T cell proliferation	GO:0035742
inflammation	activated T cell autonomous cell death	GO:0070238
inflammation	activated T cell proliferation	GO:0050798
inflammation	activation of NF-kappaB-inducing kinase activity	GO:0007250
inflammation	activation of plasma proteins involved in acute inflammatory response	GO:0002541
inflammation	acute inflammatory response	GO:0002526
inflammation	acute inflammatory response to antigenic stimulus	GO:0002438
inflammation	acute inflammatory response to non-antigenic stimulus	GO:0002525
inflammation	arachidonic acid metabolic process	GO:0019369
inflammation	arachidonic acid metabolite production involved in inflammatory response	GO:0002538
inflammation	arachidonic acid secretion	GO:0050482
inflammation	chemokine (C-C motif) ligand 1 production	GO:0071610
inflammation	chemokine (C-C motif) ligand 11 production	GO:0071954
inflammation	chemokine (C-C motif) ligand 19 signaling pathway	GO:0038115
inflammation	chemokine (C-C motif) ligand 2 secretion	GO:0035926
inflammation	chemokine (C-C motif) ligand 2 signaling pathway	GO:0038148
inflammation	chemokine (C-C motif) ligand 21 signaling pathway	GO:0038116
inflammation	chemokine (C-C motif) ligand 22 production	GO:0071924
inflammation	chemokine (C-C motif) ligand 4 production	GO:0071606
inflammation	chemokine (C-C motif) ligand 5 production	GO:0071609
inflammation	chemokine (C-C motif) ligand 5 signaling pathway	GO:0035689
inflammation	chemokine (C-C motif) ligand 6 production	GO:0035530
inflammation	chemokine (C-C motif) ligand 6 secretion	GO:0035534
inflammation	chemokine (C-X-C motif) ligand 1 production	GO:0072566
inflammation	chemokine (C-X-C motif) ligand 12 signaling pathway	GO:0038146
inflammation	chemokine (C-X-C motif) ligand 2 production	GO:0072567
inflammation	chemokine (C-X-C motif) ligand 9 production	GO:0035393
inflammation	chemokine biosynthetic process	GO:0042033
inflammation	chemokine metabolic process	GO:0050755
inflammation	chemokine production	GO:0032602
inflammation	chemokine receptor transport out of membrane raft	GO:0032600
inflammation	chemokine receptor transport within lipid bilayer	GO:0033606
inflammation	chemokine secretion	GO:0090195
inflammation	chemokine-mediated signaling pathway	GO:0070098
inflammation	chronic inflammatory response	GO:0002544
inflammation	chronic inflammatory response to antigenic stimulus	GO:0002439
inflammation	chronic inflammatory response to non-antigenic stimulus	GO:0002545
inflammation	cytokine production involved in inflammatory response	GO:0002534
inflammation	cytokine-mediated signaling pathway	GO:0019221
inflammation	histamine production involved in inflammatory response	GO:0002349
inflammation	histamine secretion by mast cell	GO:0002553
inflammation	histamine secretion involved in inflammatory response	GO:0002441
inflammation	inflammatory cell apoptotic process	GO:0006925
inflammation	inflammatory response	GO:0006954
inflammation	inflammatory response to antigenic stimulus	GO:0002437
inflammation	leukotriene production involved in inflammatory response	GO:0002540
inflammation	lysosomal enzyme production involved in inflammatory response	GO:0002393
inflammation	lysosomal enzyme secretion involved in inflammatory response	GO:0002533
inflammation	modulation by organism of inflammatory response of other organism involved in symbiotic interaction	GO:0052256
inflammation	modulation by organism of symbiont inflammatory response	GO:0052451
inflammation	modulation by symbiont of host inflammatory response	GO:0052032
inflammation	negative regulation by organism of inflammatory response of other organism involved in symbiotic interaction	GO:0052260
inflammation	negative regulation by organism of symbiont inflammatory response	GO:0052485
inflammation	negative regulation by symbiont of host inflammatory response	GO:0052036
inflammation	negative regulation of NLRP3 inflammasome complex assembly	GO:1900226
inflammation	negative regulation of acute inflammatory response	GO:0002674
inflammation	negative regulation of acute inflammatory response to antigenic stimulus	GO:0002865
inflammation	negative regulation of acute inflammatory response to non-antigenic stimulus	GO:0002878
inflammation	negative regulation of chronic inflammatory response	GO:0002677
inflammation	negative regulation of chronic inflammatory response to antigenic stimulus	GO:0002875
inflammation	negative regulation of chronic inflammatory response to non-antigenic stimulus	GO:0002881
inflammation	negative regulation of cytokine production involved in inflammatory response	GO:1900016
inflammation	negative regulation of inflammatory response	GO:0050728
inflammation	negative regulation of inflammatory response to antigenic stimulus	GO:0002862
inflammation	negative regulation of interferon-alpha biosynthetic process	GO:0045355
inflammation	negative regulation of interferon-alpha production	GO:0032687
inflammation	negative regulation of interferon-beta biosynthetic process	GO:0045358
inflammation	negative regulation of interferon-beta production	GO:0032688
inflammation	negative regulation of interferon-beta secretion	GO:0035548
inflammation	negative regulation of interferon-gamma biosynthetic process	GO:0045077
inflammation	negative regulation of interferon-gamma production	GO:0032689
inflammation	negative regulation of interferon-gamma-mediated signaling pathway	GO:0060336
inflammation	negative regulation of interleukin-1 alpha biosynthetic process	GO:0050723
inflammation	negative regulation of interleukin-1 alpha production	GO:0032690
inflammation	negative regulation of interleukin-1 alpha secretion	GO:0050712
inflammation	negative regulation of interleukin-1 beta biosynthetic process	GO:0050724
inflammation	negative regulation of interleukin-1 beta production	GO:0032691
inflammation	negative regulation of interleukin-1 beta secretion	GO:0050713
inflammation	negative regulation of interleukin-1 biosynthetic process	GO:0045361
inflammation	negative regulation of interleukin-1 production	GO:0032692
inflammation	negative regulation of interleukin-1 secretion	GO:0050711
inflammation	negative regulation of interleukin-1-mediated signaling pathway	GO:2000660
inflammation	negative regulation of interleukin-10 biosynthetic process	GO:0045081
inflammation	negative regulation of interleukin-10 production	GO:0032693
inflammation	negative regulation of interleukin-10 secretion	GO:2001180
inflammation	negative regulation of interleukin-11 biosynthetic process	GO:0045364
inflammation	negative regulation of interleukin-11 production	GO:0032694
inflammation	negative regulation of interleukin-12 biosynthetic process	GO:0045083
inflammation	negative regulation of interleukin-12 production	GO:0032695
inflammation	negative regulation of interleukin-12 secretion	GO:2001183
inflammation	negative regulation of interleukin-13 biosynthetic process	GO:0045367
inflammation	negative regulation of interleukin-13 production	GO:0032696
inflammation	negative regulation of interleukin-13 secretion	GO:2000666
inflammation	negative regulation of interleukin-14 biosynthetic process	GO:0045370
inflammation	negative regulation of interleukin-14 production	GO:0032697
inflammation	negative regulation of interleukin-15 biosynthetic process	GO:0045373
inflammation	negative regulation of interleukin-15 production	GO:0032698
inflammation	negative regulation of interleukin-16 biosynthetic process	GO:0045376
inflammation	negative regulation of interleukin-16 production	GO:0032699
inflammation	negative regulation of interleukin-17 biosynthetic process	GO:0045379
inflammation	negative regulation of interleukin-17 production	GO:0032700
inflammation	negative regulation of interleukin-18 biosynthetic process	GO:0045382
inflammation	negative regulation of interleukin-18 production	GO:0032701
inflammation	negative regulation of interleukin-18-mediated signaling pathway	GO:2000493
inflammation	negative regulation of interleukin-19 biosynthetic process	GO:0045385
inflammation	negative regulation of interleukin-19 production	GO:0032702
inflammation	negative regulation of interleukin-2 biosynthetic process	GO:0045085
inflammation	negative regulation of interleukin-2 production	GO:0032703
inflammation	negative regulation of interleukin-2 secretion	GO:1900041
inflammation	negative regulation of interleukin-20 biosynthetic process	GO:0045388
inflammation	negative regulation of interleukin-20 production	GO:0032704
inflammation	negative regulation of interleukin-21 biosynthetic process	GO:0045391
inflammation	negative regulation of interleukin-21 production	GO:0032705
inflammation	negative regulation of interleukin-22 biosynthetic process	GO:0045394
inflammation	negative regulation of interleukin-22 production	GO:0032706
inflammation	negative regulation of interleukin-23 biosynthetic process	GO:0045397
inflammation	negative regulation of interleukin-23 production	GO:0032707
inflammation	negative regulation of interleukin-24 biosynthetic process	GO:0045532
inflammation	negative regulation of interleukin-24 production	GO:0032708
inflammation	negative regulation of interleukin-25 biosynthetic process	GO:0045533
inflammation	negative regulation of interleukin-25 production	GO:0032709
inflammation	negative regulation of interleukin-26 biosynthetic process	GO:0045534
inflammation	negative regulation of interleukin-26 production	GO:0032710
inflammation	negative regulation of interleukin-27 biosynthetic process	GO:0045535
inflammation	negative regulation of interleukin-27 production	GO:0032711
inflammation	negative regulation of interleukin-27-mediated signaling pathway	GO:0070108
inflammation	negative regulation of interleukin-3 biosynthetic process	GO:0045400
inflammation	negative regulation of interleukin-3 production	GO:0032712
inflammation	negative regulation of interleukin-35 biosynthetic process	GO:0070751
inflammation	negative regulation of interleukin-35 production	GO:0070755
inflammation	negative regulation of interleukin-35-mediated signaling pathway	GO:0070759
inflammation	negative regulation of interleukin-4 biosynthetic process	GO:0045403
inflammation	negative regulation of interleukin-4 production	GO:0032713
inflammation	negative regulation of interleukin-5 biosynthetic process	GO:0045406
inflammation	negative regulation of interleukin-5 production	GO:0032714
inflammation	negative regulation of interleukin-5 secretion	GO:2000663
inflammation	negative regulation of interleukin-6 biosynthetic process	GO:0045409
inflammation	negative regulation of interleukin-6 production	GO:0032715
inflammation	negative regulation of interleukin-6 secretion	GO:1900165
inflammation	negative regulation of interleukin-6-mediated signaling pathway	GO:0070104
inflammation	negative regulation of interleukin-7 biosynthetic process	GO:0045412
inflammation	negative regulation of interleukin-7 production	GO:0032716
inflammation	negative regulation of interleukin-8 biosynthetic process	GO:0045415
inflammation	negative regulation of interleukin-8 production	GO:0032717
inflammation	negative regulation of interleukin-8 secretion	GO:2000483
inflammation	negative regulation of interleukin-9 biosynthetic process	GO:0045418
inflammation	negative regulation of interleukin-9 production	GO:0032718
inflammation	negative regulation of leukotriene production involved in inflammatory response	GO:0035492
inflammation	negative regulation of respiratory burst involved in inflammatory response	GO:0060266
inflammation	positive regulation by organism of inflammatory response of other organism involved in symbiotic interaction	GO:0052259
inflammation	positive regulation by organism of symbiont inflammatory response	GO:0052514
inflammation	positive regulation by symbiont of host inflammatory response	GO:0052035
inflammation	positive regulation of ERK1 and ERK2 cascade via TNFSF11-mediated signaling	GO:0071848
inflammation	positive regulation of NLRP3 inflammasome complex assembly	GO:1900227
inflammation	positive regulation of acute inflammatory response	GO:0002675
inflammation	positive regulation of acute inflammatory response to antigenic stimulus	GO:0002866
inflammation	positive regulation of acute inflammatory response to non-antigenic stimulus	GO:0002879
inflammation	positive regulation of chronic inflammatory response	GO:0002678
inflammation	positive regulation of chronic inflammatory response to antigenic stimulus	GO:0002876
inflammation	positive regulation of chronic inflammatory response to non-antigenic stimulus	GO:0002882
inflammation	positive regulation of cytokine production involved in inflammatory response	GO:1900017
inflammation	positive regulation of inflammatory response	GO:0050729
inflammation	positive regulation of inflammatory response to antigenic stimulus	GO:0002863
inflammation	positive regulation of leukotriene production involved in inflammatory response	GO:0035491
inflammation	positive regulation of respiratory burst involved in inflammatory response	GO:0060265
inflammation	production of molecular mediator involved in inflammatory response	GO:0002532
inflammation	prostaglandin production involved in inflammatory response	GO:0002539
inflammation	regulation of NLRP3 inflammasome complex assembly	GO:1900225
inflammation	regulation of acute inflammatory response	GO:0002673
inflammation	regulation of acute inflammatory response to antigenic stimulus	GO:0002864
inflammation	regulation of acute inflammatory response to non-antigenic stimulus	GO:0002877
inflammation	regulation of chemokine (C-C motif) ligand 1 production	GO:0071652
inflammation	regulation of chemokine (C-C motif) ligand 4 production	GO:0071643
inflammation	regulation of chemokine (C-C motif) ligand 5 production	GO:0071649
inflammation	regulation of chemokine (C-C motif) ligand 6 production	GO:0035531
inflammation	regulation of chemokine (C-C motif) ligand 6 secretion	GO:0035535
inflammation	regulation of chemokine (C-X-C motif) ligand 1 production	GO:2000338
inflammation	regulation of chemokine (C-X-C motif) ligand 2 production	GO:2000341
inflammation	regulation of chemokine (C-X-C motif) ligand 9 production	GO:0035394
inflammation	regulation of chemokine activity	GO:1900136
inflammation	regulation of chemokine biosynthetic process	GO:0045073
inflammation	regulation of chemokine production	GO:0032642
inflammation	regulation of chemokine secretion	GO:0090196
inflammation	regulation of chemokine-mediated signaling pathway	GO:0070099
inflammation	regulation of chronic inflammatory response	GO:0002676
inflammation	regulation of chronic inflammatory response to antigenic stimulus	GO:0002874
inflammation	regulation of chronic inflammatory response to non-antigenic stimulus	GO:0002880
inflammation	regulation of cytokine activity	GO:0060300
inflammation	regulation of cytokine biosynthetic process	GO:0042035
inflammation	regulation of cytokine production	GO:0001817
inflammation	regulation of cytokine production involved in inflammatory response	GO:1900015
inflammation	regulation of cytokine secretion	GO:0050707
inflammation	regulation of cytokine-mediated signaling pathway	GO:0001959
inflammation	regulation of inflammatory response	GO:0050727
inflammation	regulation of inflammatory response by sphingosine-1-phosphate signaling pathway	GO:0003378
inflammation	regulation of inflammatory response to antigenic stimulus	GO:0002861
inflammation	regulation of interferon-alpha biosynthetic process	GO:0045354
inflammation	regulation of interferon-alpha production	GO:0032647
inflammation	regulation of interferon-beta biosynthetic process	GO:0045357
inflammation	regulation of interferon-beta production	GO:0032648
inflammation	regulation of interferon-beta secretion	GO:0035547
inflammation	regulation of interferon-gamma biosynthetic process	GO:0045072
inflammation	regulation of interferon-gamma production	GO:0032649
inflammation	regulation of interferon-gamma-mediated signaling pathway	GO:0060334
inflammation	regulation of interleukin-1 alpha biosynthetic process	GO:0050721
inflammation	regulation of interleukin-1 alpha production	GO:0032650
inflammation	regulation of interleukin-1 alpha secretion	GO:0050705
inflammation	regulation of interleukin-1 beta biosynthetic process	GO:0050722
inflammation	regulation of interleukin-1 beta production	GO:0032651
inflammation	regulation of interleukin-1 beta secretion	GO:0050706
inflammation	regulation of interleukin-1 biosynthetic process	GO:0045360
inflammation	regulation of interleukin-1 production	GO:0032652
inflammation	regulation of interleukin-1 secretion	GO:0050704
inflammation	regulation of interleukin-1-mediated signaling pathway	GO:2000659
inflammation	regulation of interleukin-10 biosynthetic process	GO:0045074
inflammation	regulation of interleukin-10 production	GO:0032653
inflammation	regulation of interleukin-10 secretion	GO:2001179
inflammation	regulation of interleukin-11 biosynthetic process	GO:0045363
inflammation	regulation of interleukin-11 production	GO:0032654
inflammation	regulation of interleukin-12 biosynthetic process	GO:0045075
inflammation	regulation of interleukin-12 production	GO:0032655
inflammation	regulation of interleukin-12 secretion	GO:2001182
inflammation	regulation of interleukin-13 biosynthetic process	GO:0045366
inflammation	regulation of interleukin-13 production	GO:0032656
inflammation	regulation of interleukin-13 secretion	GO:2000665
inflammation	regulation of interleukin-14 biosynthetic process	GO:0045369
inflammation	regulation of interleukin-14 production	GO:0032657
inflammation	regulation of interleukin-15 biosynthetic process	GO:0045372
inflammation	regulation of interleukin-15 production	GO:0032658
inflammation	regulation of interleukin-16 biosynthetic process	GO:0045375
inflammation	regulation of interleukin-16 production	GO:0032659
inflammation	regulation of interleukin-17 biosynthetic process	GO:0045378
inflammation	regulation of interleukin-17 production	GO:0032660
inflammation	regulation of interleukin-18 biosynthetic process	GO:0045381
inflammation	regulation of interleukin-18 production	GO:0032661
inflammation	regulation of interleukin-18-mediated signaling pathway	GO:2000492
inflammation	regulation of interleukin-19 biosynthetic process	GO:0045384
inflammation	regulation of interleukin-19 production	GO:0032662
inflammation	regulation of interleukin-2 biosynthetic process	GO:0045076
inflammation	regulation of interleukin-2 production	GO:0032663
inflammation	regulation of interleukin-2 secretion	GO:1900040
inflammation	regulation of interleukin-20 biosynthetic process	GO:0045387
inflammation	regulation of interleukin-20 production	GO:0032664
inflammation	regulation of interleukin-21 biosynthetic process	GO:0045390
inflammation	regulation of interleukin-21 production	GO:0032665
inflammation	regulation of interleukin-22 biosynthetic process	GO:0045393
inflammation	regulation of interleukin-22 production	GO:0032666
inflammation	regulation of interleukin-23 biosynthetic process	GO:0045396
inflammation	regulation of interleukin-23 production	GO:0032667
inflammation	regulation of interleukin-24 biosynthetic process	GO:0045528
inflammation	regulation of interleukin-24 production	GO:0032668
inflammation	regulation of interleukin-25 biosynthetic process	GO:0045529
inflammation	regulation of interleukin-25 production	GO:0032669
inflammation	regulation of interleukin-26 biosynthetic process	GO:0045530
inflammation	regulation of interleukin-26 production	GO:0032670
inflammation	regulation of interleukin-27 biosynthetic process	GO:0045531
inflammation	regulation of interleukin-27 production	GO:0032671
inflammation	regulation of interleukin-27-mediated signaling pathway	GO:0070107
inflammation	regulation of interleukin-3 biosynthetic process	GO:0045399
inflammation	regulation of interleukin-3 production	GO:0032672
inflammation	regulation of interleukin-35 biosynthetic process	GO:0070750
inflammation	regulation of interleukin-35 production	GO:0070754
inflammation	regulation of interleukin-35-mediated signaling pathway	GO:0070758
inflammation	regulation of interleukin-4 biosynthetic process	GO:0045402
inflammation	regulation of interleukin-4 production	GO:0032673
inflammation	regulation of interleukin-4-dependent isotype switching to IgE isotypes	GO:2000571
inflammation	regulation of interleukin-5 biosynthetic process	GO:0045405
inflammation	regulation of interleukin-5 production	GO:0032674
inflammation	regulation of interleukin-5 secretion	GO:2000662
inflammation	regulation of interleukin-6 biosynthetic process	GO:0045408
inflammation	regulation of interleukin-6 production	GO:0032675
inflammation	regulation of interleukin-6-mediated signaling pathway	GO:0070103
inflammation	regulation of interleukin-7 biosynthetic process	GO:0045411
inflammation	regulation of interleukin-7 production	GO:0032676
inflammation	regulation of interleukin-8 biosynthetic process	GO:0045414
inflammation	regulation of interleukin-8 production	GO:0032677
inflammation	regulation of interleukin-8 secretion	GO:2000482
inflammation	regulation of interleukin-9 biosynthetic process	GO:0045417
inflammation	regulation of interleukin-9 production	GO:0032678
inflammation	regulation of leukotriene production involved in inflammatory response	GO:0035490
inflammation	regulation of respiratory burst involved in inflammatory response	GO:0060264
inflammation	regulation of vascular permeability involved in acute inflammatory response	GO:0002528
inflammation	respiratory burst involved in inflammatory response	GO:0002536
inflammation	serotonin production involved in inflammatory response	GO:0002351
inflammation	serotonin secretion involved in inflammatory response	GO:0002442
infectious	bacillithiol biosynthetic process	GO:0071793
infectious	bacillithiol metabolic process	GO:0071792
infectious	bacitracin A biosynthetic process	GO:1901124
infectious	bacitracin A catabolic process	GO:1901123
infectious	bacitracin A metabolic process	GO:1901122
infectious	bacterial-type EF-P lysine modification	GO:0072580
infectious	bacterial-type flagellar cell motility	GO:0071973
infectious	bacterial-type flagellar swarming motility	GO:0071978
infectious	bacterial-type flagellar swimming motility	GO:0071977
infectious	bacteriochlorophyll biosynthetic process	GO:0030494
infectious	bacteriochlorophyll catabolic process	GO:0030495
infectious	bacteriochlorophyll metabolic process	GO:0030493
infectious	bacteriocin biosynthetic process	GO:0030152
infectious	bacteriocin catabolic process	GO:0046225
infectious	bacteriocin immunity	GO:0030153
infectious	bacteriocin metabolic process	GO:0046224
