Roche CV	GO term name	GO term ID	
DNA silencing	heterochromatin maintenance involved in chromatin silencing	GO:0070870
DNA silencing	heterochromatin organization involved in chromatin silencing	GO:0070868
DNA silencing	host cellular process involved in virus induced gene silencing	GO:0060144
DNA silencing	host gene silencing in virus induced gene silencing	GO:0060146
DNA silencing	long-distance posttranscriptional gene silencing	GO:0010495
DNA silencing	mRNA cleavage involved in gene silencing by miRNA	GO:0035279
DNA silencing	maintenance of chromatin silencing	GO:0006344
DNA silencing	maintenance of chromatin silencing at silent mating-type cassette	GO:0035391
DNA silencing	methylation-dependent chromatin silencing	GO:0006346
DNA silencing	miRNA loading onto RISC involved in gene silencing by miRNA	GO:0035280
DNA silencing	negative regulation of gene silencing	GO:0060969
DNA silencing	negative regulation of gene silencing by RNA	GO:0060967
DNA silencing	negative regulation of gene silencing by miRNA	GO:0060965
DNA silencing	negative regulation of methylation-dependent chromatin silencing	GO:0090310
DNA silencing	negative regulation of posttranscriptional gene silencing	GO:0060149
DNA silencing	negative regulation of translation involved in gene silencing by miRNA	GO:0035278
DNA silencing	positive regulation of chromatin silencing	GO:0031937
DNA silencing	positive regulation of chromatin silencing at rDNA	GO:2000749
DNA silencing	positive regulation of chromatin silencing at silent mating-type cassette	GO:0090055
DNA silencing	positive regulation of gene silencing by miRNA	GO:2000637
DNA silencing	positive regulation of methylation-dependent chromatin silencing	GO:0090309
DNA silencing	positive regulation of posttranscriptional gene silencing	GO:0060148
DNA silencing	posttranscriptional gene silencing	GO:0016441
DNA silencing	posttranscriptional gene silencing by RNA	GO:0035194
DNA silencing	production of miRNAs involved in gene silencing by miRNA	GO:0035196
DNA silencing	production of siRNA involved in chromatin silencing by small RNA	GO:0070919
DNA silencing	production of small RNA involved in gene silencing by RNA	GO:0070918
DNA silencing	regulation of gene silencing	GO:0060968
DNA silencing	regulation of gene silencing by RNA	GO:0060966
DNA silencing	regulation of gene silencing by miRNA	GO:0060964
DNA silencing	regulation of methylation-dependent chromatin silencing	GO:0090308
DNA silencing	regulation of posttranscriptional gene silencing	GO:0060147
DNA silencing	regulation of production of siRNA involved in chromatin silencing by small RNA	GO:0070921
DNA silencing	regulation of production of small RNA involved in gene silencing by RNA	GO:0070920
DNA silencing	siRNA loading onto RISC involved in chromatin silencing by small RNA	GO:0070923
DNA replication negative	cis-acting DNA replication termination	GO:0071946
DNA replication	DNA replication	GO:0006260
DNA replication	DNA replication and chromosome cycle	GO:0000067
DNA replication	DNA replication checkpoint	GO:0000076
DNA replication	DNA replication initiation	GO:0006270
DNA replication	DNA replication preinitiation complex assembly	GO:0071163
DNA replication	DNA replication proofreading	GO:0045004
DNA replication	DNA replication termination	GO:0006274
DNA replication	DNA replication, Okazaki fragment processing	GO:0033567
DNA replication	DNA replication, removal of RNA primer	GO:0043137
DNA replication	DNA replication, synthesis of RNA primer	GO:0006269
DNA replication	DNA replication-dependent nucleosome assembly	GO:0006335
DNA replication	DNA replication-dependent nucleosome disassembly	GO:0034725
DNA replication	DNA replication-dependent nucleosome organization	GO:0034723
DNA replication	DNA replication-independent nucleosome assembly	GO:0006336
DNA replication	DNA replication-independent nucleosome disassembly	GO:0034726
DNA replication	DNA replication-independent nucleosome organization	GO:0034724
DNA replication	DNA restriction-modification system	GO:0009307
DNA replication	DNA secretion by the type IV secretion system	GO:0044098
DNA replication	DNA strand elongation	GO:0022616
DNA replication	DNA strand elongation involved in DNA replication	GO:0006271
DNA replication	DNA strand renaturation involved in double-strand break repair	GO:0061306
DNA replication	DNA synthesis involved in DNA repair	GO:0000731
DNA replication	DNA synthesis involved in double-strand break repair via homologous recombination	GO:0043150
DNA replication	DNA synthesis involved in double-strand break repair via single-strand annealing	GO:0043151
DNA replication	DNA-dependent DNA replication	GO:0006261
DNA replication	G-quadruplex DNA formation	GO:0071919
DNA replication	GINS complex	GO:0000811
DNA replication	cytoplasmic origin of replication recognition complex	GO:0000809
DNA replication	initiation of premeiotic DNA replication	GO:0072691
DNA replication	negative regulation of DNA-directed DNA polymerase activity	GO:1900263
DNA replication	nuclear cell cycle DNA replication	GO:0033260
DNA replication	origin recognition complex	GO:0000808
DNA replication	positive regulation of DNA-directed DNA polymerase activity	GO:1900264
DNA replication	regulation of DNA replication	GO:0006275
DNA replication	regulation of DNA replication initiation involved in plasmid copy number maintenance	GO:0060909
DNA replication	regulation of DNA replication termination	GO:2000621
DNA replication	regulation of DNA strand elongation	GO:0060382
DNA replication	regulation of DNA-dependent DNA replication	GO:0090329
DNA replication	regulation of DNA-dependent DNA replication initiation	GO:0030174
DNA replication	regulation of DNA-directed DNA polymerase activity	GO:1900262
DNA replication	regulation of DNA-templated transcription, elongation	GO:0032784
DNA replication	regulation of nuclear cell cycle DNA replication	GO:0033262
DNA repair	UV-damage excision repair	GO:0070914
DNA repair	base-excision repair	GO:0006284
DNA repair	base-excision repair, AP site formation	GO:0006285
DNA repair	base-excision repair, DNA ligation	GO:0006288
DNA repair	base-excision repair, base-free sugar-phosphate removal	GO:0006286
DNA repair	base-excision repair, gap-filling	GO:0006287
DNA repair	double-strand break repair via break-induced replication	GO:0000727
DNA repair	double-strand break repair via homologous recombination	GO:0000724
DNA repair	double-strand break repair via single-strand annealing, removal of nonhomologous ends	GO:0000736
DNA repair	error-free DNA repair	GO:0045021
DNA repair	error-free postreplication DNA repair	GO:0042275
DNA repair	error-prone DNA repair	GO:0045020
DNA repair	gene conversion at mating-type locus, DNA repair synthesis	GO:0000734
DNA repair	histone H3-K56 acetylation in response to DNA damage	GO:0097044
DNA repair	histone H4 acetylation involved in response to DNA damage stimulus	GO:2000776
DNA repair	mismatch base pair DNA N-glycosylase activity	GO:0000700
DNA repair	mismatch repair involved in maintenance of fidelity involved in DNA-dependent DNA replication	GO:0070716
DNA repair	non-photoreactive DNA repair	GO:0010213
DNA repair	non-recombinational interstrand cross-link repair	GO:0036299
DNA repair	non-recombinational repair	GO:0000726
DNA repair	nucleotide-excision repair	GO:0006289
DNA repair	nucleotide-excision repair complex	GO:0000109
DNA repair	nucleotide-excision repair factor 1 complex	GO:0000110
DNA repair	nucleotide-excision repair factor 2 complex	GO:0000111
DNA repair	nucleotide-excision repair factor 3 complex	GO:0000112
DNA repair	nucleotide-excision repair factor 4 complex	GO:0000113
DNA repair	nucleotide-excision repair involved in interstrand cross-link repair	GO:1901255
DNA repair	nucleotide-excision repair, DNA damage recognition	GO:0000715
DNA repair	nucleotide-excision repair, DNA damage removal	GO:0000718
DNA repair	nucleotide-excision repair, DNA duplex unwinding	GO:0000717
DNA repair	nucleotide-excision repair, DNA gap filling	GO:0006297
DNA repair	nucleotide-excision repair, DNA incision	GO:0033683
DNA repair	nucleotide-excision repair, DNA incision, 3'-to lesion	GO:0006295
DNA repair	nucleotide-excision repair, DNA incision, 5'-to lesion	GO:0006296
DNA repair	nucleotide-excision repair, preincision complex assembly	GO:0006294
DNA repair	nucleotide-excision repair, preincision complex stabilization	GO:0006293
DNA repair	oxidized base lesion DNA N-glycosylase activity	GO:0000702
DNA repair	photoreactive repair	GO:0000719
DNA repair	purine-specific mismatch base pair DNA N-glycosylase activity	GO:0000701
DNA repair	pyrimidine-dimer repair, DNA damage excision	GO:0006291
DNA repair	pyrimidine-dimer repair, DNA damage recognition	GO:0006292
DNA repair	recombinational repair	GO:0000725
DNA repair	regulation of DNA repair	GO:0006282
DNA repair	regulation of double-strand break repair	GO:2000779
DNA repair	regulation of double-strand break repair via homologous recombination	GO:0010569
DNA repair	regulation of double-strand break repair via nonhomologous end joining	GO:2001032
DNA repair	removal of nonhomologous ends	GO:0000735
DNA repair	single strand break repair	GO:0000012
DNA repair	strand displacement	GO:0000732
DNA recombination	non-replicative transposition, DNA-mediated	GO:0098038
DNA recombination	somatic cell DNA recombination	GO:0016444
DNA recombination	transposon integration	GO:0070893
DNA dynamics	CENP-A containing nucleosome assembly at centromere	GO:0034080
DNA dynamics	DNA ADP-ribosylation	GO:0030592
DNA dynamics	DNA alkylation	GO:0006305
DNA dynamics	DNA amplification	GO:0006277
DNA dynamics	DNA biosynthetic process	GO:0071897
DNA dynamics	DNA catabolic process	GO:0006308
DNA dynamics	DNA catabolic process, endonucleolytic	GO:0000737
DNA dynamics	DNA catabolic process, exonucleolytic	GO:0000738
DNA dynamics	DNA conformation change	GO:0071103
DNA dynamics	DNA cytosine deamination	GO:0070383
DNA dynamics	DNA dealkylation	GO:0035510
DNA dynamics	DNA dealkylation involved in DNA repair	GO:0006307
DNA dynamics	DNA deamination	GO:0045006
DNA dynamics	DNA demethylation	GO:0080111
DNA dynamics	DNA double-strand break processing	GO:0000729
DNA dynamics	DNA double-strand break processing involved in repair via single-strand annealing	GO:0010792
DNA dynamics	DNA double-strand break processing involved in repair via synthesis-dependent strand annealing	GO:0010791
DNA dynamics	DNA duplex unwinding	GO:0032508
DNA dynamics	DNA endoreduplication	GO:0042023
DNA dynamics	DNA excision	GO:0044349
DNA dynamics	DNA geometric change	GO:0032392
DNA dynamics	DNA hypermethylation	GO:0044026
DNA dynamics	DNA hypomethylation	GO:0044028
DNA dynamics	DNA import into cell involved in transformation	GO:0009290
DNA dynamics	DNA integration	GO:0015074
DNA dynamics	DNA integrity checkpoint	GO:0031570
DNA dynamics	DNA ligation	GO:0006266
DNA dynamics	DNA ligation involved in DNA recombination	GO:0051102
DNA dynamics	DNA ligation involved in DNA repair	GO:0051103
DNA dynamics	DNA ligation involved in DNA-dependent DNA replication	GO:0051104
DNA dynamics	DNA mediated transformation	GO:0009294
DNA dynamics	DNA metabolic process	GO:0006259
DNA dynamics	DNA methylation	GO:0006306
DNA dynamics	DNA methylation involved in embryo development	GO:0043045
DNA dynamics	DNA methylation involved in gamete generation	GO:0043046
DNA dynamics	DNA methylation on adenine	GO:0032775
DNA dynamics	DNA methylation on cytosine	GO:0032776
DNA dynamics	DNA methylation on cytosine within a CG sequence	GO:0010424
DNA dynamics	DNA methylation on cytosine within a CHH sequence	GO:0010426
DNA dynamics	DNA methylation on cytosine within a CNG sequence	GO:0010425
DNA dynamics	DNA modification	GO:0006304
DNA dynamics	DNA packaging	GO:0006323
DNA dynamics	DNA protection	GO:0042262
DNA dynamics	DNA recombinase assembly	GO:0000730
DNA dynamics	DNA recombinase assembly involved in gene conversion at mating-type locus	GO:0034624
DNA dynamics	DNA recombination	GO:0006310
DNA dynamics	DNA repair	GO:0006281
DNA dynamics	DNA rewinding	GO:0036292
DNA dynamics	DNA strand renaturation	GO:0000733
DNA dynamics	DNA topological change	GO:0006265
DNA dynamics	DNA transport	GO:0051027
DNA dynamics	DNA unwinding involved in DNA replication	GO:0006268
DNA dynamics	DNA virus induced gene silencing	GO:0051215
DNA dynamics	HIR complex	GO:0000417
DNA dynamics	Swr1 complex	GO:0000812
DNA dynamics	attachment of chromatin to nuclear envelope	GO:0097240
DNA dynamics	bent DNA binding	GO:0003681
DNA dynamics	central element	GO:0000801
DNA dynamics	chromatin	GO:0000785
DNA dynamics	chromatin assembly	GO:0031497
DNA dynamics	chromatin assembly or disassembly	GO:0006333
DNA dynamics	chromatin disassembly	GO:0031498
DNA dynamics	chromatin insulator sequence binding	GO:0006341
DNA dynamics	chromatin maintenance	GO:0070827
DNA dynamics	chromatin modification	GO:0016568
DNA dynamics	chromatin organization	GO:0006325
DNA dynamics	chromatin remodeling	GO:0006338
DNA dynamics	chromatin remodeling at centromere	GO:0031055
DNA dynamics	chromatin remodeling in response to cation stress	GO:0043156
DNA dynamics	chromatin silencing	GO:0006342
DNA dynamics	chromatin silencing at centromere	GO:0030702
DNA dynamics	chromatin silencing at centromere central core	GO:0072692
DNA dynamics	chromatin silencing at rDNA	GO:0000183
DNA dynamics	chromatin silencing at silent mating-type cassette	GO:0030466
DNA dynamics	chromatin silencing at telomere	GO:0006348
DNA dynamics	chromatin silencing by small RNA	GO:0031048
DNA dynamics	chromosome breakage	GO:0031052
DNA dynamics	chromosome condensation	GO:0030261
DNA dynamics	chromosome decondensation	GO:0051312
DNA dynamics	chromosome localization	GO:0050000
DNA dynamics	chromosome localization to nuclear envelope involved in synapsis	GO:0090220
DNA dynamics	chromosome organization	GO:0051276
DNA dynamics	chromosome organization involved in meiosis	GO:0070192
DNA dynamics	chromosome passenger complex localization to kinetochore	GO:0072356
DNA dynamics	chromosome passenger complex localization to spindle midzone	GO:0035853
DNA dynamics	chromosome segregation	GO:0007059
DNA dynamics	chromosome separation	GO:0051304
DNA dynamics	chromosome, centromeric region	GO:0000775
DNA dynamics	chromosome, telomeric region	GO:0000781
DNA dynamics	condensed chromosome	GO:0000793
DNA dynamics	condensed chromosome kinetochore	GO:0000777
DNA dynamics	condensed chromosome, centromeric region	GO:0000779
DNA dynamics	condensed nuclear chromosome	GO:0000794
DNA dynamics	condensed nuclear chromosome kinetochore	GO:0000778
DNA dynamics	condensed nuclear chromosome, centromeric region	GO:0000780
DNA dynamics	condensin complex	GO:0000796
DNA dynamics	condensin core heterodimer	GO:0000797
DNA dynamics	cytoplasmic chromatin	GO:0000789
DNA dynamics	cytoplasmic nucleosome	GO:0000787
DNA dynamics	establishment of chromatin silencing at telomere	GO:0035390
DNA dynamics	establishment of protein localization to telomere	GO:0070200
DNA dynamics	euchromatin	GO:0000791
DNA dynamics	formation of extrachromosomal circular DNA	GO:0001325
DNA dynamics	gene conversion at mating-type locus, DNA double-strand break formation	GO:0000728
DNA dynamics	gene conversion at mating-type locus, DNA double-strand break processing	GO:0031292
DNA dynamics	heterochromatin	GO:0000792
DNA dynamics	heterochromatin assembly	GO:0031507
DNA dynamics	heterochromatin assembly involved in chromatin silencing	GO:0070869
DNA dynamics	heterochromatin assembly involved in chromatin silencing by small RNA	GO:0070924
DNA dynamics	histone acetyltransferase complex	GO:0000123
DNA dynamics	hydrolytic DNA demethylation	GO:0035512
DNA dynamics	kinetochore	GO:0000776
DNA dynamics	lateral element	GO:0000800
DNA dynamics	maintenance of DNA methylation	GO:0010216
DNA dynamics	maintenance of DNA repeat elements	GO:0043570
DNA dynamics	maintenance of DNA trinucleotide repeats	GO:0035753
DNA dynamics	maintenance of chromatin silencing at telomere	GO:0035392
DNA dynamics	negative regulation of DNA recombination at telomere	GO:0048239
DNA dynamics	negative regulation of chromatin assembly or disassembly	GO:0045798
DNA dynamics	negative regulation of chromatin binding	GO:0035562
DNA dynamics	negative regulation of chromatin silencing	GO:0031936
DNA dynamics	negative regulation of chromatin silencing at rDNA	GO:0061188
DNA dynamics	negative regulation of chromatin silencing at silent mating-type cassette	GO:0061186
DNA dynamics	negative regulation of chromatin silencing at telomere	GO:0031939
DNA dynamics	negative regulation of chromatin silencing by small RNA	GO:0060906
DNA dynamics	negative regulation of chromatin silencing involved in replicative cell aging	GO:0001308
DNA dynamics	negative regulation of cohesin localization to chromatin	GO:0071923
DNA dynamics	negative regulation of extent of heterochromatin assembly	GO:0033696
DNA dynamics	negative regulation of extrachromosomal rDNA circle accumulation involved in replicative cell aging	GO:1900008
DNA dynamics	negative regulation of heterochromatin assembly	GO:0031452
DNA dynamics	negative regulation of telomere maintenance	GO:0032205
DNA dynamics	negative regulation of telomere maintenance via recombination	GO:0032208
DNA dynamics	negative regulation of telomere maintenance via semi-conservative replication	GO:0032214
DNA dynamics	negative regulation of telomere maintenance via telomerase	GO:0032211
DNA dynamics	negative regulation of transposition, DNA-mediated	GO:0000335
DNA dynamics	nuclear MIS12/MIND complex	GO:0000818
DNA dynamics	nuclear chromatin	GO:0000790
DNA dynamics	nuclear chromosome, telomeric region	GO:0000784
DNA dynamics	nuclear cohesin complex	GO:0000798
DNA dynamics	nuclear condensin complex	GO:0000799
DNA dynamics	nuclear nucleosome	GO:0000788
DNA dynamics	nuclear telomere cap complex	GO:0000783
DNA dynamics	nucleosome	GO:0000786
DNA dynamics	oxidative DNA demethylation	GO:0035511
DNA dynamics	oxidative single-stranded DNA demethylation	GO:0035552
DNA dynamics	positive regulation of DNA recombination at telomere	GO:0072696
DNA dynamics	positive regulation of chromatin assembly or disassembly	GO:0045799
DNA dynamics	positive regulation of chromatin silencing at centromere	GO:0090053
DNA dynamics	positive regulation of chromatin silencing at telomere	GO:0031940
DNA dynamics	positive regulation of extent of heterochromatin assembly	GO:0033697
DNA dynamics	positive regulation of heterochromatin assembly	GO:0031453
DNA dynamics	positive regulation of telomere maintenance	GO:0032206
DNA dynamics	positive regulation of telomere maintenance via recombination	GO:0032209
DNA dynamics	positive regulation of telomere maintenance via semi-conservative replication	GO:0032215
DNA dynamics	positive regulation of telomere maintenance via telomerase	GO:0032212
DNA dynamics	positive regulation of transposition, DNA-mediated	GO:0000336
DNA dynamics	protection from non-homologous end joining at telomere	GO:0031848
DNA dynamics	protein-DNA ISRE complex assembly	GO:0035362
DNA dynamics	protein-DNA complex assembly	GO:0065004
DNA dynamics	protein-DNA complex disassembly	GO:0032986
DNA dynamics	protein-DNA complex remodeling	GO:0001120
DNA dynamics	protein-DNA complex subunit organization	GO:0071824
DNA dynamics	protein-DNA complex transport	GO:0015869
DNA dynamics	protein-DNA covalent cross-linking	GO:0018142
DNA dynamics	protein-DNA covalent cross-linking via peptidyl-serine	GO:0018145
DNA dynamics	protein-DNA covalent cross-linking via peptidyl-threonine	GO:0018164
DNA dynamics	protein-DNA covalent cross-linking via peptidyl-tyrosine	GO:0045327
DNA dynamics	protein-DNA covalent cross-linking via the 3'-end to peptidyl-tyrosine	GO:0045326
DNA dynamics	protein-DNA covalent cross-linking via the 5'-end to peptidyl-tyrosine	GO:0018163
DNA dynamics	protein-DNA-RNA complex	GO:0001114
DNA dynamics	protein-DNA-RNA complex assembly	GO:0001116
DNA dynamics	protein-DNA-RNA complex disassembly	GO:0001117
DNA dynamics	protein-DNA-RNA complex remodeling	GO:0001119
DNA dynamics	protein-DNA-RNA complex subunit organization	GO:0001115
DNA dynamics	regulation of DNA binding	GO:0051101
DNA dynamics	regulation of DNA biosynthetic process	GO:2000278
DNA dynamics	regulation of DNA endoreduplication	GO:0032875
DNA dynamics	regulation of DNA ligation	GO:0051105
DNA dynamics	regulation of DNA metabolic process	GO:0051052
DNA dynamics	regulation of DNA methylation	GO:0044030
DNA dynamics	regulation of DNA recombination	GO:0000018
DNA dynamics	regulation of DNA recombination at telomere	GO:0072695
DNA dynamics	regulation of DNA topoisomerase (ATP-hydrolyzing) activity	GO:2000371
DNA dynamics	regulation of centromere complex assembly	GO:0090230
DNA dynamics	regulation of chromatin assembly	GO:0010847
DNA dynamics	regulation of chromatin assembly or disassembly	GO:0001672
DNA dynamics	regulation of chromatin binding	GO:0035561
DNA dynamics	regulation of chromatin disassembly	GO:0010848
DNA dynamics	regulation of chromatin silencing	GO:0031935
DNA dynamics	regulation of chromatin silencing at centromere	GO:0090052
DNA dynamics	regulation of chromatin silencing at rDNA	GO:0061187
DNA dynamics	regulation of chromatin silencing at silent mating-type cassette	GO:0090054
DNA dynamics	regulation of chromatin silencing at telomere	GO:0031938
DNA dynamics	regulation of chromatin silencing by small RNA	GO:0010964
DNA dynamics	regulation of establishment of protein localization to telomere	GO:0070203
DNA dynamics	regulation of extent of heterochromatin assembly	GO:0031454
DNA dynamics	regulation of telomere maintenance	GO:0032204
DNA dynamics	regulation of telomere maintenance via recombination	GO:0032207
DNA dynamics	regulation of telomere maintenance via semi-conservative replication	GO:0032213
DNA dynamics	regulation of telomere maintenance via telomerase	GO:0032210
DNA dynamics	regulation of transposition, DNA-mediated	GO:0000337
DNA dynamics	single-stranded DNA endodeoxyribonuclease activity	GO:0000014
DNA dynamics	synaptonemal complex	GO:0000795
DNA dynamics	telomere cap complex	GO:0000782
DNA dynamics	transverse filament	GO:0000802
DNA damage	DNA damage checkpoint	GO:0000077
DNA damage	DNA damage induced protein phosphorylation	GO:0006975
DNA damage	DNA damage response, detection of DNA damage	GO:0042769
DNA damage	DNA damage response, signal transduction by p53 class mediator	GO:0030330
DNA damage	DNA damage response, signal transduction by p53 class mediator resulting in cell cycle arrest	GO:0006977
DNA damage	DNA damage response, signal transduction by p53 class mediator resulting in transcription of p21 class mediator	GO:0006978
DNA damage	DNA damage response, signal transduction resulting in transcription	GO:0042772
DNA damage	G1 DNA damage checkpoint	GO:0044783
DNA damage	cellular response to DNA damage stimulus	GO:0006974
DNA damage	detection of DNA damage stimulus involved in DNA damage checkpoint	GO:0072421
DNA damage	detection of DNA damage stimulus involved in G2 DNA damage checkpoint	GO:0072424
DNA damage	detection of DNA damage stimulus involved in intra-S DNA damage checkpoint	GO:0072427
DNA damage	detection of DNA damage stimulus involved in mitotic G1 DNA damage checkpoint	GO:0072430
DNA damage	detection of DNA damage stimulus involved in mitotic G2 DNA damage checkpoint	GO:0072433
DNA damage	intra-S DNA damage checkpoint	GO:0031573
DNA damage	intrinsic apoptotic signaling pathway in response to DNA damage	GO:0008630
DNA damage	intrinsic apoptotic signaling pathway in response to DNA damage by p53 class mediator	GO:0042771
DNA damage	negative regulation of DNA damage checkpoint	GO:2000002
DNA damage	negative regulation of DNA damage response, signal transduction by p53 class mediator	GO:0043518
DNA damage	negative regulation of response to DNA damage stimulus	GO:2001021
DNA damage	negative regulation of transcription from RNA polymerase II promoter in response to UV-induced DNA damage	GO:0010768
DNA damage	positive regulation of DNA damage checkpoint	GO:2000003
DNA damage	positive regulation of DNA damage response, signal transduction by p53 class mediator	GO:0043517
DNA damage	positive regulation of response to DNA damage stimulus	GO:2001022
DNA damage	regulation of DNA damage checkpoint	GO:2000001
DNA damage	regulation of DNA damage response, signal transduction by p53 class mediator	GO:0043516
DNA damage	regulation of histone H4 acetylation involved in response to DNA damage stimulus	GO:2000873
DNA damage	regulation of response to DNA damage stimulus	GO:2001020
DNA damage	regulation of transcription from RNA polymerase II promoter in response to UV-induced DNA damage	GO:0010767
DNA damage	response to DNA damage checkpoint signaling	GO:0072423
DNA damage	response to G1 DNA damage checkpoint signaling	GO:0072432
DNA damage	response to G2 DNA damage checkpoint signaling	GO:0072426
DNA damage	response to intra-S DNA damage checkpoint signaling	GO:0072429
DNA damage	response to mitotic G2 DNA damage checkpoint signaling	GO:0072435
DNA damage	signal initiation by physical damage	GO:0023039
DNA damage	signal transduction in response to DNA damage	GO:0042770
DNA damage	signal transduction involved in DNA damage checkpoint	GO:0072422
DNA damage	signal transduction involved in G2 DNA damage checkpoint	GO:0072425
DNA damage	signal transduction involved in intra-S DNA damage checkpoint	GO:0072428
DNA damage	signal transduction involved in mitotic G1 DNA damage checkpoint	GO:0072431
DNA damage	signal transduction involved in mitotic G2 DNA damage checkpoint	GO:0072434
DNA binding process	RNA polymerase I regulatory region DNA binding	GO:0001013
DNA binding process	RNA polymerase II core promoter proximal region sequence-specific DNA binding	GO:0000978
DNA binding process	RNA polymerase II core promoter sequence-specific DNA binding	GO:0000979
DNA binding process	RNA polymerase II distal enhancer sequence-specific DNA binding	GO:0000980
DNA binding process	RNA polymerase II regulatory region DNA binding	GO:0001012
DNA binding process	RNA polymerase II regulatory region sequence-specific DNA binding	GO:0000977
